id,descriptions,release_date
717,Voluptatem voluptatibus consequatur deserunt. Eos dolores voluptatibus alias libero voluptas. Qui quo voluptatem eos dolorum alias amet explicabo voluptas sed. Occaecati quis ipsa maiores quae ut. Tempore ex eos qui et reiciendis. Itaque consectetur et. Omnis in placeat quis non asperiores sunt alias. Accusantium esse error et. Dolor vitae aliquid facere rerum et vitae iste molestiae.,2018-09-10T11:33:54.044Z
718,Magnam voluptatem eum velit aliquid qui accusamus omnis. Dolore odio nemo accusamus eum porro perferendis et. Quam deleniti quia. Quidem expedita aut ducimus perferendis. Ex rerum recusandae voluptas voluptas necessitatibus sit modi placeat dolorum. Numquam dolorem voluptatem. Nam eaque praesentium impedit ut et eos minus. Quia voluptatem repellat. Sit praesentium sit.,2012-05-08T03:34:40.410Z
719,Et optio dolore consequatur dignissimos. Sint id nam quis maxime et molestiae adipisci. Sint facilis perferendis nobis quia dolorem et autem enim sapiente. Libero corrupti aut eaque et pariatur reprehenderit cupiditate. Blanditiis dolore dolorem incidunt sequi ipsum quos reiciendis ab. Quia enim consectetur dolorum recusandae. Ut corporis neque iste quisquam rerum esse.,2017-10-16T00:58:34.408Z
720,Labore dolorum provident autem. Cupiditate est quis assumenda modi. A deleniti incidunt qui perspiciatis ab voluptate voluptas. Repellendus in ipsum voluptatem eligendi at. Culpa similique eligendi temporibus consequatur est quia repellat. Accusamus aut et veniam. Iure est recusandae eius amet ea laborum et accusamus tenetur. Perferendis illo molestiae facere occaecati sed quidem. Exercitationem temporibus nemo unde. Adipisci deserunt nihil deleniti iste velit sed aut assumenda magnam.,2017-07-17T18:52:11.560Z
721,Qui et in magni animi nihil exercitationem exercitationem consectetur est. Molestias unde est ea est reprehenderit. Voluptatem similique cum. Laboriosam nobis pariatur quibusdam. Aliquid nihil qui. Veniam ut facere unde rerum dicta libero voluptatem. Ab natus placeat tempora. Ut ex est id et doloribus voluptate fugit tempore officiis.,2011-09-21T04:36:49.082Z
722,Non ipsam tempora. Necessitatibus ex dignissimos modi hic quisquam eveniet. Modi temporibus sed veniam. Asperiores cumque repudiandae. Neque dolorem voluptatem et fugiat. Dolore adipisci quos. Et quia a facere in magni quod. Eius quam ea velit vitae tenetur rerum veritatis nihil eligendi.,2015-01-02T02:54:17.910Z
723,Omnis sint a reiciendis non dolores. Consequuntur autem repellat pariatur nostrum et sequi. Corrupti non velit. Doloribus dolor dolorum voluptas fugit rerum dolor dolore ut. Laudantium nihil quibusdam. Et ut quibusdam aut alias. Provident non delectus.,2018-08-31T00:24:46.312Z
724,Doloremque quia et ullam delectus. Non eius reprehenderit officiis illum autem fugiat temporibus ea. Recusandae aperiam dolores vero. Est quis accusantium. Accusantium sit possimus. Earum sit voluptatibus aperiam alias et voluptatum impedit nostrum aspernatur. Non veritatis dignissimos molestiae asperiores sed nulla laboriosam molestiae ut. Corporis maxime quidem fuga magni non commodi quisquam beatae. Repellendus labore debitis facilis tempora perspiciatis ut est.,2011-01-09T06:53:24.078Z
725,Saepe tempore asperiores totam voluptatem quo repudiandae amet qui. Ab dolor sint ducimus amet. Eligendi qui veritatis fugiat eum molestiae. Nam provident hic. Maiores quaerat dolorem incidunt vel aspernatur in est ullam dolorum. Quis omnis ipsa fuga sed totam veritatis debitis voluptatem. Molestias error praesentium fuga. Provident repudiandae officiis tempora. Excepturi qui sapiente enim tempora nostrum accusantium eligendi corporis. Praesentium maiores doloremque praesentium distinctio repudiandae repellat. Maiores ex non harum ut itaque id accusamus.,2016-05-27T04:36:42.761Z
726,Eum eaque in recusandae pariatur molestiae aut. Eveniet fuga et similique unde quo reiciendis. Velit sint vel sapiente omnis vel consectetur illo. Porro iusto sed dicta aliquid molestiae labore in odit. Alias maiores non voluptatem deleniti. Non rerum eligendi quos tempore sit explicabo animi ea. Debitis sit in commodi possimus dolore et et ipsa dolor. Molestias tempora pariatur voluptas. Error veritatis et qui quo ea amet.,2012-03-25T15:19:14.397Z
727,Ut molestiae alias est placeat atque incidunt qui modi. Inventore voluptate maxime recusandae aperiam. Et nemo tempora velit. Placeat omnis ipsum rerum recusandae unde reiciendis quas temporibus quos. Ab placeat explicabo aut quia iste accusamus hic sed necessitatibus. Enim unde cumque blanditiis asperiores. Nobis eum consequuntur fugit facere aliquid magnam. Nobis temporibus nisi repellat. Reprehenderit non et sequi eum illo tempora molestias velit. Natus quisquam tenetur rerum consequatur. Voluptas dolorem nesciunt rerum ut inventore.,2019-02-19T09:55:29.546Z
728,Sed quidem quis sunt et exercitationem. Asperiores sit rerum accusantium excepturi asperiores ullam sit impedit. Quo debitis officiis mollitia enim. Autem occaecati corrupti ad voluptatibus. Quia ipsum quia adipisci libero velit ut eligendi. Hic sit hic quia. Iusto voluptatibus cupiditate totam laboriosam qui maiores iste. Nihil et quam atque commodi. Ullam rerum eligendi atque repellat quam dolor. Culpa praesentium quia dolorem impedit rerum sit dignissimos. Non veniam quo est quae at.,2011-08-20T16:29:41.810Z
729,Impedit quidem nihil et dolorem atque aut asperiores aut velit. Qui deserunt et aut ducimus molestiae et. Non aut facilis tempora atque ut asperiores sequi fuga adipisci. Laborum praesentium non maiores suscipit ex iste. Exercitationem ipsa eius rem fugit saepe quibusdam omnis et sed. Iure voluptatum vero consequuntur consequatur est ut quos. Quae ea omnis. Ut dicta voluptatibus velit deleniti similique sequi nulla ipsam.,2015-04-12T09:31:35.266Z
730,Ratione sed nam architecto quia commodi. Est nemo optio omnis est inventore quia voluptas corrupti et. Doloribus ducimus molestiae temporibus explicabo. Odit magni animi aspernatur blanditiis adipisci quod rem beatae quaerat. Repellat magni recusandae dolor est suscipit et non et. Quis rerum ut libero nobis aperiam saepe. Ipsam architecto ipsam. Dignissimos officiis expedita iste aut delectus. Et delectus culpa reprehenderit veritatis eius numquam. Quos fugit ab.,2013-12-13T06:11:11.371Z
731,Voluptatem veritatis aut minus placeat dolor. Ullam eos iste labore rerum dolores doloremque tempora provident expedita. Saepe quos est eius sunt quasi sed minus voluptatum. Animi ducimus et eaque et facilis magni iure ea. Autem voluptatum est labore. Recusandae enim fugiat temporibus. Ratione facere eveniet adipisci sequi quod repellendus nihil quo non. Error ea facere accusamus ex dolorum. Numquam occaecati inventore voluptas dolores cupiditate sint amet ipsum. Animi similique ea deserunt eveniet dolore blanditiis autem.,2019-10-04T13:12:49.322Z
732,Eos aut aut neque est libero nihil voluptate. Amet facere dignissimos temporibus. Maiores dolorem pariatur. Recusandae tempore in officia. Sit natus facilis ut perferendis fuga perferendis et ducimus. Qui quam libero sunt cupiditate provident at ut eveniet. Et ad nam illum. Sint vel fuga tempora reiciendis non inventore magnam quia eum. Sunt occaecati eaque ea quia optio sunt inventore iure.,2017-06-29T05:09:07.211Z
733,Fugit eum qui distinctio inventore voluptatem reprehenderit atque dolore. Rerum quo sit et. Voluptatem in ut consectetur maiores. Aut est omnis ut quaerat dolorum possimus aut exercitationem optio. Laboriosam beatae quia aut maiores non aut minus. Sit eum vero neque dolores consequatur quia et. Esse saepe culpa quam. Sint nam esse adipisci. Atque qui modi temporibus. Sunt qui omnis sed odit velit sunt et modi amet.,2012-12-29T10:23:44.739Z
734,Dolor ducimus quam commodi odio magni qui quo quibusdam similique. Consectetur atque voluptas officiis et aut voluptatem maxime delectus. Sunt molestias maiores mollitia. Sit fugit sunt eos. Eum consequuntur voluptas unde. Adipisci libero omnis perspiciatis doloremque et delectus et aut. Nostrum eos sed iure unde. Ut tempora nemo voluptate voluptatum reiciendis.,2020-01-03T06:39:59.722Z
735,Ipsam eos dolores rerum et. Accusamus autem voluptas quibusdam et modi alias quo et. Qui officia est optio magnam repudiandae ea beatae nostrum et. Neque doloremque vel quia. Sequi eius quis est odio eveniet ex. Veritatis totam voluptas dignissimos quasi aut optio doloribus beatae amet. Ut sunt ullam et rerum consequatur porro sapiente. Et quam consequatur et voluptate enim quasi.,2016-05-17T10:05:55.493Z
736,Itaque soluta quas qui soluta ea. Non qui omnis expedita velit. Est doloribus unde. Dolor quasi placeat placeat. Dolore repudiandae molestias dolores sapiente rerum pariatur. Unde magnam et rem. Pariatur ex perferendis numquam. Unde voluptatem corrupti voluptas. Et optio ut doloribus eos. Expedita incidunt ut nulla ipsa.,2018-04-09T16:30:50.385Z
737,Ut quos consequuntur aut qui suscipit. Deleniti enim repellat dolor possimus aspernatur amet odio sapiente. Distinctio tempora explicabo. Consectetur voluptas quidem. Facilis exercitationem in unde illum. Recusandae ullam quis itaque est nam. Aut porro ut dolorum velit repellendus suscipit at doloremque. Dolor eius veritatis quae nihil tenetur fugit atque minima sunt. Sed laborum dicta dolor odio dicta voluptatibus autem molestiae laboriosam.,2015-04-01T15:26:57.198Z
738,Nihil ducimus quae qui labore ea et. Error dolores perferendis ut dolorum. Mollitia libero omnis in quo. Doloribus molestiae in laboriosam minus sapiente soluta quisquam rerum est. At delectus pariatur consequatur ullam nihil est. Numquam quod omnis nihil ut voluptatem ex autem quis maiores. Itaque et et laudantium et. Autem aut est tempore beatae facilis dolorem.,2018-10-03T23:02:52.490Z
739,Eos qui aspernatur debitis atque. Non ut cumque. Iusto et velit numquam impedit et. Beatae dolores cum aspernatur temporibus. Ducimus culpa suscipit. Ex est et quia dolores. Labore harum reprehenderit voluptatem quidem voluptatem distinctio mollitia qui in. Quis omnis nostrum deserunt at odio et. Velit accusantium quos aliquam qui.,2017-01-25T22:18:56.669Z
740,Et quis quo. Magni voluptates deleniti et quia necessitatibus. Consequuntur amet labore inventore quis aut provident minima. Quam sint id maxime neque. Et nostrum earum adipisci provident ipsum. Voluptate harum et nobis earum consectetur. Id modi atque nihil in consequatur sapiente voluptates. Qui dignissimos dolorem consequatur neque numquam. Ut qui quia tempore nesciunt corrupti aut corporis. Ea vero error sint harum non atque corporis.,2012-08-10T04:00:15.011Z
741,Aut rerum qui qui velit ut. Error ea et nisi facilis sunt ratione aut. Vel quibusdam soluta aut ad in. Fuga dolores in in earum commodi. Harum perspiciatis odit veritatis nostrum minus vel eos suscipit quisquam. Vitae maiores dolore est. Est sed nihil molestias. Veritatis aliquid impedit dolor est harum blanditiis. Veritatis eligendi incidunt tempora eos nam.,2014-11-29T13:07:29.697Z
742,Natus earum ea qui voluptate doloremque aut accusamus et. Illum beatae rerum vitae ea quis quisquam repellendus velit. Rerum illum est quasi quam. Natus aut illo eos sunt vel. Est aut sapiente dolorem ad quas. Ipsum officia ab. Sequi recusandae ducimus accusantium ut excepturi. Atque rerum harum quis sit omnis odit.,2014-10-30T01:53:45.332Z
743,Iusto velit ut omnis maiores ut rem cumque ut voluptas. Consequuntur suscipit pariatur quibusdam. Quae quidem repellat cumque. Eius voluptate libero non alias ut eveniet quas. Laborum id possimus quia omnis. Consequatur explicabo cumque id. Eveniet maxime rerum voluptatem animi suscipit velit nobis nam repellat. Sint qui et voluptates ab tempora. Sit doloribus labore a.,2010-11-21T06:18:01.401Z
744,Debitis quo accusantium. A ducimus qui quasi numquam error molestias nihil natus dolorum. Fugiat possimus qui quos ipsum esse quas dolores sapiente. Et rerum reprehenderit dolorem. Architecto sint et fugit adipisci sunt et. Saepe suscipit esse possimus nesciunt harum et modi quos. Temporibus repudiandae maiores non. Libero hic saepe quos accusantium molestiae aliquam sapiente amet ut.,2020-01-19T23:06:56.205Z
745,Iste ab eaque ducimus tenetur qui. Quas qui consequatur sapiente laborum asperiores sed in optio. Repellendus cum ea deserunt ut nesciunt et illo corporis voluptatem. Dignissimos natus velit quo ipsa sequi dolorem sed nihil. Est culpa hic eum aut similique omnis. Vel numquam nobis occaecati accusamus facilis sed. Veritatis suscipit architecto doloremque asperiores ex error inventore animi delectus. Velit ut quaerat deleniti in ut. Dolores neque fuga et quia adipisci omnis minus ea. Doloremque numquam ipsa omnis iure quia sequi voluptates fugit.,2011-07-25T22:03:55.852Z
746,Magni est accusantium. Et molestias nihil sit ipsa maiores. Sit eum eos qui cumque itaque eaque dolores doloribus hic. Vitae est quasi explicabo nisi. Et sed voluptatibus neque. Vitae sint non perspiciatis nihil et. Tenetur voluptas et nesciunt harum autem.,2012-09-11T08:09:16.831Z
747,Quis nulla qui voluptatem nihil nostrum. Ut sit assumenda qui possimus blanditiis eveniet ut accusantium molestiae. Dolores voluptas ut et. Enim aut qui culpa aut eos et. Dignissimos incidunt voluptatem consequatur. Ullam minima quia ratione nam incidunt rem. Occaecati blanditiis ullam. Harum adipisci ut temporibus sit officia impedit doloribus. Facere ea in voluptatem corrupti ullam fuga. Autem illum aut ut sit eos ipsum magnam velit.,2017-07-20T11:30:13.095Z
748,Quidem omnis doloribus rem totam perspiciatis repudiandae. Dolor omnis autem necessitatibus quo ut distinctio dolor amet. Voluptatibus dolore excepturi cupiditate quasi est eaque assumenda incidunt. Reiciendis architecto delectus tempore. Et vel veniam inventore explicabo magni. Ut magni et in sint et minima minima id voluptatibus.,2015-09-20T06:09:21.860Z
749,Ratione nobis in rerum. Iste voluptatem temporibus et rerum sunt reiciendis vero. Eos doloribus dolorum maiores rerum. Quod dolores eum iure. Vitae esse provident cupiditate inventore laudantium odit enim quisquam. Expedita rerum sapiente. Magni tenetur consequatur vero dolorem voluptas. Modi qui et fugit. Rem saepe quos.,2016-08-29T18:14:20.308Z
750,Deleniti praesentium tempora asperiores eos reprehenderit aut inventore architecto nihil. Qui ex a nihil architecto qui non nam et ad. Consequatur dolorem repellat voluptatem aut harum. Rerum non voluptatem voluptatem blanditiis adipisci corrupti dolores et molestiae. Sint nesciunt dolor. Cum aut ducimus sit. Dolore dolores minima nostrum est recusandae. Ut tempore quo ipsam vero. Sequi omnis aut error exercitationem occaecati ut cumque odit dolore. Ex iure quod vel iure ipsum quaerat amet autem tempora.,2013-02-05T18:27:34.979Z
751,Rem modi eius excepturi nisi provident similique labore. Ut provident alias rerum a. Mollitia voluptatem sunt omnis adipisci. Magni rem deleniti veritatis ut quia dolorum non. Magnam et optio labore enim praesentium eveniet architecto. Dolor nostrum quam. Aut nihil sequi culpa nostrum voluptatum. Sunt aut et consequatur aut velit. Inventore eius quo hic repellat. Soluta est nam molestiae sed beatae.,2017-07-25T23:00:53.397Z
752,Excepturi sed delectus sed illo quia delectus nam quibusdam illo. Consequatur officiis rerum praesentium quam quas tenetur. Sunt esse omnis sed saepe aut sit et architecto laboriosam. Quo dolor aliquid voluptas sint quidem molestias non mollitia. Accusamus ratione sapiente. Perferendis molestiae aut quia rem nemo est. Perferendis est aliquam fugiat. Omnis illum omnis et nostrum excepturi. Est quasi quae animi. Illum quo vitae tempora vel alias. Iste enim eaque voluptas provident doloribus.,2014-12-02T07:41:47.303Z
753,Voluptas corrupti maxime consequatur numquam et voluptas repellendus. Ea corporis ut tempora quidem autem et hic. Quas tempore commodi delectus eos consectetur non voluptas et. Ut dignissimos qui possimus cum eum ratione quia ea labore. Quia voluptate sit ratione repudiandae. Sit quibusdam sed sunt sunt aut. Autem exercitationem dolor quia non repellat cumque aut consectetur. Omnis porro qui officiis sed error officiis est fugiat. Quaerat ut dolore corrupti.,2011-03-12T14:23:43.628Z
754,Quis vero dignissimos in aut ea dolor voluptatem. Excepturi suscipit eveniet ea. Ab aut voluptatum deserunt at deserunt sed. Voluptas excepturi repellat ut deleniti perspiciatis expedita saepe dolorum. Dolore incidunt tempora laudantium quo illo dolore tempore dolor. Distinctio modi et quos. Blanditiis consequatur nisi laboriosam ut eum et soluta sit autem.,2018-12-23T19:53:42.272Z
755,Nostrum voluptatem unde et sed omnis alias cupiditate qui. Doloribus vel dignissimos modi est hic voluptatibus qui totam. Qui atque amet tempora aut quia laboriosam numquam sit molestias. Corporis amet saepe et delectus expedita et neque. Minima provident voluptates laudantium corporis earum ut. Veniam aspernatur nihil facilis aut itaque magnam. Expedita in id repellendus ipsam voluptatem qui. Quisquam tempore dolores. Nulla sint voluptatem.,2015-05-22T10:14:47.650Z
756,Commodi magni ut quia facere neque et. Adipisci ipsa sit. Dolor nulla velit sed. Alias blanditiis id ut. Velit quo repellat non. Et dolorum eaque sapiente nobis nostrum asperiores est fugiat dolor.,2020-01-17T13:38:47.693Z
757,Quam omnis enim pariatur iure quisquam est molestiae est. Tempora praesentium est consequatur exercitationem distinctio illo accusantium aliquid quis. Quis molestiae consectetur quos repudiandae labore eligendi. Eos eum magni accusantium tempore. Omnis et repudiandae. Ipsum velit consequatur fugiat ipsum fugiat ut nihil neque perferendis. Enim dolor velit tempore dignissimos molestiae enim.,2013-01-28T20:52:39.609Z
758,Fugiat nostrum laborum et doloremque ullam expedita in debitis. Cupiditate aspernatur repudiandae debitis rem voluptate quia. Soluta repellat voluptates soluta similique delectus ut et. Laborum voluptatem vero ut minus sed quisquam commodi voluptas magni. Earum in doloribus. Et unde quia porro et provident. Qui occaecati sed non quia. Autem et tenetur incidunt. Earum ipsum nobis quam quis aperiam est modi. Et corrupti aliquam consequatur. Qui voluptas est. Non rerum ea.,2017-07-27T23:39:02.957Z
759,Ea non quas at voluptatem veniam quos eius minus. Enim delectus fugiat qui nemo aliquam perferendis occaecati. Rerum sunt rerum impedit recusandae. Sed aliquam dolor harum. Neque tempora cupiditate hic et doloribus id. Cumque et facilis. Ut unde dignissimos facilis voluptatum aut iste.,2019-06-09T08:25:04.026Z
760,Ut sunt quia voluptatibus quaerat. Consequatur distinctio qui non eum. Accusantium ea quod quibusdam est hic. Neque aut quia dolor optio et omnis ratione est enim. Sunt praesentium iure consequatur odit atque dolores rem reiciendis. Vero qui id rerum adipisci. Ipsum cum enim et recusandae rerum qui temporibus aut eius. Aut sint rem et fuga dignissimos doloribus enim rem eligendi. Et ea sunt dolores repellendus in nulla doloribus omnis architecto.,2019-01-08T22:32:07.486Z
761,Sit minus soluta nihil necessitatibus quia. Rerum aut dolor ex sed quae. Molestiae minus cupiditate. Maxime dolores aliquam sit. Voluptatem aliquam et voluptatibus sed dolore. Qui delectus sapiente debitis ipsam. Dolores nobis sequi consequatur velit voluptatem mollitia omnis id labore.,2013-03-11T02:48:16.248Z
762,Esse esse sint minus fuga. Sequi provident voluptatem soluta enim nisi laboriosam. Rerum ducimus voluptas aspernatur suscipit voluptates corrupti aut. Et earum alias tenetur quod iure ut. Itaque sit et culpa veritatis. Ad repellat ipsa molestiae rerum amet quod. Quibusdam corrupti recusandae qui voluptate. Voluptas ut vitae et.,2019-05-22T10:34:21.071Z
763,Nobis nam esse debitis. Sequi iste quisquam qui est debitis autem. Et debitis laboriosam amet earum officiis. Doloribus et est optio voluptatem molestiae. Suscipit consequatur non exercitationem impedit qui. Dolores voluptatem quis. Magni aperiam voluptatem sequi adipisci odio officia quia vel corporis. Commodi quam vel voluptates beatae impedit dolore. Neque amet et exercitationem. Consequuntur praesentium expedita libero. Eligendi et quis vel.,2016-08-25T18:39:37.668Z
764,Non quia distinctio sed ea inventore voluptate. Blanditiis enim autem dolorum ipsum quaerat optio. Esse qui molestiae enim magni ut. Blanditiis ratione eum ea eum reiciendis corporis ex. Sint quia omnis vel consequatur. Dolorem deleniti id quaerat placeat alias officia illum quo. Quibusdam quo laudantium soluta aut autem rem debitis. Sit pariatur ut ipsam quo. Tempore sunt totam qui.,2020-01-30T02:39:43.306Z
765,Et suscipit cumque beatae non aut exercitationem et voluptatem autem. Sit sit dolor numquam omnis delectus pariatur eveniet. Pariatur nobis consequatur perspiciatis. Enim beatae occaecati est quam et ut beatae eveniet. Nihil sapiente rerum ipsa laudantium eveniet rem aut. Reprehenderit molestiae perspiciatis rerum consequatur. Cum totam officiis expedita dolor placeat. Commodi totam eaque excepturi enim. Nostrum dolorum nobis quae eaque non repellendus. Incidunt modi qui facere. Omnis provident et veniam consequatur recusandae autem tempore.,2014-05-27T22:15:26.091Z
766,Ex fugiat quo at at sunt quos vero omnis. Modi dolore eum fuga consequatur excepturi quisquam accusantium. Deleniti nisi esse porro cupiditate qui. In perspiciatis est nesciunt omnis et nobis. Est illo molestiae quos dolores. Ad tenetur incidunt quas quia qui perferendis eum earum est. Amet eius quia vitae velit nostrum.,2017-04-16T05:35:02.324Z
767,Animi officiis molestiae sunt praesentium. Veniam autem aut rerum ducimus qui odio. Magni aut ullam distinctio explicabo quis. Ducimus perspiciatis ut magni eveniet culpa commodi a. Aut architecto reiciendis neque voluptas itaque vel numquam. Sed quia autem omnis est omnis facere. Maiores nostrum ipsam ea fugit laboriosam. Voluptatem eum et et at. Perspiciatis provident recusandae amet quia ut natus. Voluptatem dolorum velit vel assumenda sit est quam. Id necessitatibus magnam repellendus a est. Nulla sed amet dolorem dolorum eius ut fuga.,2014-12-31T05:40:32.748Z
768,Architecto autem sint voluptas omnis harum fugit quidem repellat. Aut et aut sed repellat optio consequatur pariatur. Et quidem velit et dolorem dicta aut quos commodi. Ullam quos ducimus eaque reiciendis dolore sunt ducimus error autem. Voluptas ducimus eaque delectus sit rem dolores qui. Minima voluptatibus et dolor incidunt voluptas quisquam voluptatum.,2016-04-11T15:11:40.020Z
769,Nesciunt modi quidem neque ducimus commodi molestiae. Id corporis nihil sed alias adipisci est sed. Eum praesentium quos fuga consequatur. Deleniti aut id voluptatum impedit in qui voluptas. Amet odit veritatis et rerum tempore nemo est quae eius. Velit est facere ratione voluptatibus pariatur non. Rerum repellendus qui possimus impedit. Quis aliquid perferendis perspiciatis eos qui. Est dolores commodi et est. Omnis rerum est ea exercitationem laboriosam voluptatibus. Consequatur suscipit qui non consectetur quod maxime facere. Eos aut ut sequi vel dolor tempore explicabo est.,2012-10-06T00:55:36.076Z
770,Vitae cum sed ea. Expedita esse est quis aut voluptatem. At et odio sint vel soluta commodi quidem alias quam. Repellat aut minus dicta explicabo alias voluptas. Est molestias nihil earum deleniti recusandae id mollitia ipsa. Qui consequatur tempora est ad sed veniam. Earum officiis sunt aut dolores. Ea et qui odio eum est dolor asperiores et qui. Est voluptatum porro iure dolorum consequatur maiores sint quidem consequatur.,2019-12-18T21:02:02.553Z
771,Sed tempore accusantium inventore modi sit necessitatibus. Aut quo quo debitis. Dicta cum neque ea alias. Omnis ut et rem maiores sint enim numquam ad. Ut veniam et voluptas sit sed qui veniam autem. Voluptas earum quis vitae omnis tempora reprehenderit dolorum quibusdam. Quos est aliquid blanditiis incidunt ut saepe ea quo. Similique et ut est omnis beatae non. Deleniti illo atque pariatur temporibus modi veniam et.,2018-12-08T07:53:49.142Z
772,Quas libero quaerat exercitationem aperiam excepturi veniam adipisci. Ut illum beatae. Quaerat placeat sed. Distinctio sit eaque iste blanditiis aut officia animi magni illo. Accusantium ea numquam doloribus quis quas alias molestiae voluptatem doloremque. Cum unde adipisci ducimus voluptatem corporis qui dolore aliquam aut. Molestiae et commodi exercitationem alias eos dolorum qui ipsum. Molestiae assumenda ut et velit. Et quae omnis.,2019-12-14T07:22:47.838Z
773,Harum rerum iusto cupiditate distinctio facilis porro quisquam et. Eligendi sit voluptate omnis qui occaecati quo harum repellat sint. Voluptatum eum non aut ex enim. Deserunt aperiam in quisquam voluptatem rerum dolores reiciendis voluptatem. Velit vel delectus omnis asperiores. Et exercitationem voluptas enim.,2018-02-09T11:32:51.911Z
774,Et perferendis ut inventore eaque hic. Dolor consectetur dicta voluptas suscipit. Enim dignissimos minima quidem tenetur assumenda tenetur dolor officia. Ipsam deleniti sit voluptatibus exercitationem quibusdam tenetur ad quis molestiae. Voluptatem sit dolore ad quas sunt. Est aut aut voluptas eum. Recusandae voluptatem velit eos quibusdam impedit. Architecto voluptatem ipsum dolores eum. Ut est excepturi soluta natus ducimus. Vel rerum et autem mollitia ipsam. Quia perferendis ut amet ex voluptatum voluptatem rerum eos.,2011-08-05T14:36:58.147Z
775,Suscipit et consequuntur et incidunt labore id. Nam iure sequi omnis et explicabo odit veritatis dolores. Temporibus eum tempore quia quam necessitatibus natus quaerat ratione aut. Voluptas distinctio qui ipsam sapiente omnis vitae repudiandae vel. Ullam similique aperiam accusamus id quia assumenda ab. Impedit et quos dignissimos. Assumenda ullam quidem qui iure rem. Natus tempore illum cupiditate consequuntur minus labore quas at. Sunt aperiam cumque. Architecto sit ipsum voluptas deserunt exercitationem.,2017-03-03T10:53:19.225Z
