id,descriptions,release_date
483,Ex laborum molestiae autem quis voluptatem delectus dolorem omnis. Illum iusto ut voluptatum occaecati est blanditiis error inventore velit. Sit optio veritatis quasi sequi magnam et voluptate quas dignissimos. Libero ad laborum modi ab ex quasi expedita quia. Consequuntur eum voluptatem aut possimus odio vel animi debitis. Dolorum fugiat dolorum impedit fugit et earum est illo impedit. Ex et ut dicta.,2019-04-20T14:07:54.542Z
484,Culpa nulla dolores nihil. Non veniam et ratione magni explicabo dolorem rerum quia nostrum. Impedit qui doloremque et odio quo adipisci dolores dignissimos. Repellendus laboriosam ullam laudantium illum quae. Libero eos totam rerum. Non nihil voluptates exercitationem. Qui quidem laudantium esse qui reiciendis quam iure quisquam. Velit natus autem dolorem odit repudiandae qui est. Reiciendis maxime rerum et optio aut recusandae expedita.,2017-02-07T21:34:40.467Z
485,Rerum consequatur nam dolore voluptatibus sint dolore. Itaque voluptatibus dolorem aut officiis ipsam in earum voluptas. Commodi distinctio eius totam ut repellat voluptatem explicabo. Ad est expedita eos quibusdam natus. Est aut aut autem. Voluptatem voluptatibus quibusdam ut in suscipit. Et aperiam tempora voluptate architecto omnis atque sapiente beatae. Et libero iusto nobis. Labore enim quis ullam.,2014-09-26T21:31:53.062Z
486,Cupiditate fuga delectus et quia voluptatibus alias. Placeat incidunt corporis minima quo. Ea accusantium fugit iusto. Sit et distinctio nemo qui numquam sint odio officiis vitae. Ut perspiciatis ut. Quod nulla autem. Beatae dolores voluptatem. Sapiente placeat officia enim iure. Architecto deserunt quaerat ullam consequuntur impedit optio. Aliquam aperiam consequuntur laboriosam minima. Delectus provident minima blanditiis sit excepturi eius. Et quam laboriosam consequuntur laboriosam accusamus iste temporibus aspernatur asperiores.,2012-04-30T06:23:41.106Z
487,Voluptas non perspiciatis placeat sint qui quae. Et dolorum quis voluptatem animi voluptatem omnis enim voluptas amet. Quaerat ullam maxime autem adipisci et placeat placeat ea et. Autem assumenda recusandae nostrum. Distinctio fuga suscipit voluptatem. Itaque rerum vitae dolorem sed vel sed eveniet voluptatem. Ipsum quo culpa et harum rerum omnis inventore eos excepturi. Animi reprehenderit similique. Inventore molestiae numquam provident.,2016-02-29T19:59:14.190Z
488,Suscipit facilis fugiat quidem. Quia quas sed eaque nihil sunt est quia nihil. Consectetur doloribus doloribus dolores possimus consequatur dolor eaque ut nesciunt. Possimus qui reprehenderit et consequuntur illo itaque quidem sed. Occaecati aliquid veritatis occaecati mollitia cumque. Aliquam facilis sit et et ducimus vero illo in dolore. Quos recusandae in consequatur fuga veniam soluta facilis. Et eligendi ut quia. Labore et ipsa sunt qui sit reiciendis culpa aut.,2018-08-26T13:59:15.887Z
489,Distinctio corporis voluptas facilis voluptas eum neque. Asperiores laborum vel voluptas porro voluptas qui explicabo rerum. Rerum aliquam distinctio qui voluptates voluptatem veritatis sit cumque nesciunt. Est dicta animi rerum aspernatur quasi sed mollitia. Alias tempora minus quia necessitatibus fugiat eum. Non ipsum a commodi perspiciatis fuga qui. Molestiae rem itaque dolores. Qui suscipit distinctio ut sequi et quasi labore.,2014-09-17T00:18:54.803Z
490,Et blanditiis et ex quos ut. Illo neque incidunt odio totam iste. Quia alias vel qui ut. Voluptate magni ullam perspiciatis cupiditate. Et veniam cumque ullam vero ut reiciendis quos animi. Harum fuga ipsam et aliquam assumenda molestias dicta doloribus. Sint et et rerum sunt dolores id voluptate. Nemo reiciendis laboriosam porro iure ut totam dolorem nobis. Vitae ut omnis maxime quia. Molestias id qui mollitia placeat cum vel facere. Minus nihil dolor id.,2011-11-14T04:16:22.500Z
491,Unde aut quia aut necessitatibus. Quo nisi perspiciatis. Ipsa sint voluptas. Laudantium voluptas adipisci. Similique vel voluptates. Nostrum ut maxime id laborum. Impedit et sapiente quaerat voluptatem doloremque et porro. Voluptas doloremque cupiditate culpa et. Accusantium excepturi inventore. Fugiat voluptates qui impedit. Quos libero aut voluptas quibusdam ut ut vel.,2012-06-02T02:42:07.955Z
492,Veniam quia iure est iste libero quo aut esse. Fugiat quaerat quia eum ut rerum aut corporis est repudiandae. Exercitationem quidem fugit aliquam asperiores. Eligendi unde id qui eligendi beatae ipsum sint est. Enim error doloribus nam omnis fugit iure est. Et officiis rerum in et velit provident sint consectetur. Non consequatur nihil ea temporibus sit quos. Facere et ut cupiditate repellat harum voluptatem. Magnam magnam occaecati suscipit quos quam. Quis sint qui nesciunt.,2019-08-22T02:43:35.466Z
493,Ea dolorum voluptas. Quo impedit ut quibusdam. Sint labore quaerat ex. Laborum maxime dicta dolor cum quis nemo. Qui officia aut quo dignissimos eum assumenda ut enim. Rerum quam excepturi exercitationem voluptas sed et soluta aut repellat. Expedita commodi ut inventore blanditiis tenetur rerum laboriosam.,2018-06-28T07:51:38.287Z
494,Quos omnis asperiores eaque rerum. Repudiandae modi nostrum eum voluptatum ut. Recusandae commodi maxime dolor. Mollitia id saepe illum cupiditate veritatis dolores et. Officia ea aliquam asperiores provident dolorem in magni soluta. A nostrum id aut quia assumenda animi rem omnis et. Et molestiae neque nulla sed eius qui rerum est sunt. Non blanditiis numquam aut aut et quod.,2016-01-18T04:54:01.833Z
495,Excepturi porro rerum fugiat et quisquam explicabo dolorum et. Consequatur voluptatem soluta tempora et aut maxime. Deserunt quidem nihil hic praesentium nulla repellendus. Sint laborum quo voluptatum consequuntur nulla est qui omnis. Qui animi totam harum nulla cum sed qui accusantium. Ipsa velit atque facilis ad nulla aut. Cumque molestias vero veniam nisi dignissimos hic et qui et. Voluptatem eveniet commodi est eum in ullam.,2018-08-12T19:30:28.199Z
496,Et inventore possimus enim saepe neque consequatur beatae corporis necessitatibus. Voluptatum eum dolor minima distinctio. Laboriosam et eos sapiente hic adipisci suscipit aut ad. Autem non sunt quis nihil. Alias nesciunt et laborum voluptas unde sit. Eveniet voluptatibus consequuntur molestiae. Veritatis pariatur excepturi autem. Fuga vel perspiciatis. Perferendis debitis aut ab. Neque aliquid molestias aut quasi velit quibusdam accusantium aperiam. A reiciendis voluptas fuga.,2016-10-01T01:11:08.747Z
497,Ratione hic similique eveniet ut molestiae sapiente nihil molestias. Veniam alias repudiandae dolor. Nobis sit consequatur ea omnis. Est corporis dolorum eligendi voluptatem dolorum. Tempora omnis fugiat illum ipsam a. Enim cum animi distinctio aut blanditiis vel velit. Et rerum dolore dolorem quo ipsam placeat est eos. Sint dolorum est ut aut. Ut eos ad. In neque minima quia nihil. Excepturi voluptatem autem officia fuga quia.,2017-03-27T02:41:25.534Z
498,Dolor cum hic aperiam qui repellendus repellat beatae inventore. Voluptate excepturi dolorum. Sit sequi suscipit eligendi suscipit aspernatur rerum tempora. Consequatur enim expedita amet sapiente. Ab placeat natus dicta et quis. Et veritatis eius voluptatibus quis. Ducimus ratione quas. Velit sint veritatis id vitae eveniet non. Voluptas officiis recusandae debitis.,2011-12-01T22:12:45.797Z
499,Fugiat dolorem est commodi laudantium accusantium animi vel et. Provident nulla maxime fugiat culpa at dignissimos voluptas et iure. Voluptate id recusandae numquam. Similique non et. Amet rerum at molestiae sint. Qui dolores at tempora qui dolorum soluta voluptates culpa. Sint qui quibusdam voluptas est minima est et. Assumenda neque consequatur est repellendus aut illo laborum aperiam autem. Sit eius consequuntur dignissimos quia earum inventore ad.,2013-01-08T13:58:28.959Z
500,Corporis aut mollitia autem sit aliquid ratione iste. Nulla exercitationem et modi aperiam. Est eligendi sint doloremque eius unde et occaecati labore. Cum nam eaque. Libero aut atque veritatis sit sed et vel eaque. Voluptas architecto quam illum suscipit voluptate fugit cum ut quae. Iusto vitae aut consequuntur nobis et iure aut. In qui quidem dolore sint qui quis sed omnis non. Quo sint voluptatem eos maiores adipisci quia dignissimos nisi quam. Eligendi alias qui. Sit laudantium officiis doloribus ipsam omnis.,2012-06-30T19:54:31.927Z
501,Rerum hic alias officia. Non saepe maxime quos voluptate non. Eos qui accusantium iste enim sunt delectus blanditiis culpa. Quia possimus ad voluptatibus sed et non. Repellendus consequatur commodi qui nobis voluptas occaecati quaerat id. Enim exercitationem ducimus ut dicta. Quibusdam ut perferendis doloremque quasi voluptatem. Dolorem adipisci totam dicta impedit tenetur quo natus. Eos quibusdam officiis et non.,2014-05-13T10:50:57.070Z
502,Eligendi omnis assumenda necessitatibus. Exercitationem sit explicabo natus molestiae. Suscipit quas quos ut nihil necessitatibus ut placeat tenetur voluptatem. Et velit illum deleniti perferendis qui in architecto repudiandae quia. Harum et provident temporibus voluptatum. Est et accusantium quidem. Quisquam et odit quia et assumenda. Et labore sit dolores earum cupiditate ipsa alias.,2014-05-01T00:48:44.364Z
503,Sint voluptatem laboriosam voluptatibus autem. Perferendis aut nemo nobis facere eaque. Quam ea reiciendis nemo et eum odio laborum dolores. Culpa qui similique vitae a qui beatae est. Fuga laboriosam deleniti tempore. Voluptatibus laboriosam perferendis reiciendis nihil maxime aliquid porro debitis deserunt. Eum ut ea nihil necessitatibus libero magnam sint. Et tempore eius. Molestiae omnis sit expedita deleniti eum sunt.,2014-09-15T11:32:18.240Z
504,Quis non odit. Sed ut rerum est. Consequatur nesciunt dolores autem consequatur. Ullam aut quasi aut odio voluptatem incidunt cum error voluptatem. Recusandae quis quaerat nemo beatae magnam fuga harum in similique. Cum consectetur cupiditate. Cumque deleniti maiores nisi aut totam delectus. Alias voluptatibus ea cum sunt et qui magnam.,2020-06-12T13:39:18.332Z
505,Eum numquam officiis dolores a iure ut corporis quo. Natus nisi quia quo eos et harum. Adipisci ipsam id dolore voluptatem exercitationem et veniam quidem earum. Et corrupti harum. Et et voluptatem qui qui sit rem laborum nostrum. Ab et ipsum. Quae quis fuga ratione rem dolor qui. Cum provident rem. Et facilis eveniet quis fugiat a quod fuga ut. Officia veritatis consectetur inventore. Fugiat dolorem nihil dolorum dolorem minus est quo.,2014-03-13T02:04:25.294Z
506,Provident debitis fuga. Itaque accusantium voluptas nemo ullam optio molestiae alias. Rem sit et qui. Eum asperiores neque voluptatibus harum quia optio. Atque sed nam animi. Recusandae consequatur nulla est. Fuga ducimus non cumque eaque fugit dolorum dicta. Rerum voluptas delectus minus consequatur reiciendis aut dolorem assumenda. Facere beatae quas. Dolorum voluptas omnis est ea optio.,2014-03-02T05:54:19.683Z
507,Nihil esse voluptas dolor dolor. Reiciendis deserunt occaecati ea est. Earum dolore quod. Quisquam nam aut molestiae aut ut perferendis eos et. Veniam ut quaerat exercitationem molestias voluptatem. Qui debitis nihil sit id unde magni. Suscipit consectetur doloremque dignissimos est. Et aut consectetur minus aut quod voluptates optio eum ut.,2011-09-24T18:34:40.732Z
508,Occaecati dolorum debitis temporibus. Consequuntur eum nihil minus. Iusto consequatur voluptate enim quae ducimus omnis. Numquam iste velit voluptatem numquam deserunt eos. Dolorem similique harum quasi voluptates reiciendis occaecati voluptatum. Corrupti praesentium excepturi fugit soluta velit facere sit. Id nobis ipsam voluptatibus voluptates doloremque recusandae magni sapiente. Perspiciatis sapiente omnis provident quasi magnam molestias.,2014-11-11T09:43:01.457Z
509,Fugit molestias voluptatem pariatur numquam architecto ea reiciendis temporibus. Facilis commodi provident est quidem cumque et. Aut corporis officiis dolores velit ea odio aperiam asperiores aliquid. Beatae odio facilis consequatur labore. Dolor adipisci voluptas sint nihil occaecati quibusdam. Iure enim pariatur sunt eaque voluptates eius dolores non similique. Velit cupiditate libero quo nihil. Facere hic sed ex minus dolorem temporibus voluptatibus fuga incidunt. Modi quo optio sed aperiam qui sit ut sed rerum.,2015-03-02T04:29:15.928Z
510,Laborum optio et commodi ut perferendis. Qui velit impedit officia accusantium recusandae. Et ut velit accusamus est porro in architecto pariatur voluptatem. Et eius cum. Nobis non ut quo nihil placeat. Veritatis natus repellat incidunt commodi quos maiores quas. Pariatur non soluta voluptatem et aut in at quidem. Qui aperiam fuga corporis minima nesciunt ipsum maxime. Alias aut totam adipisci ea.,2018-03-11T18:48:14.928Z
511,Et quis nostrum id nemo consequatur non corporis. Quo velit quasi vitae debitis dignissimos omnis autem. Ut laborum architecto quos. Pariatur consequatur doloribus veniam vel velit exercitationem ullam. Excepturi quod vel minus saepe fugiat quia. Fugit harum molestias sed at magni aut. Neque et repellat. Aut iste laboriosam. Soluta harum ut delectus vero molestiae. Sed rem sed. Doloremque velit ea totam ratione cupiditate incidunt impedit deleniti ad. Nemo ea laudantium doloribus maxime et assumenda ipsa.,2011-06-26T05:35:12.000Z
512,Eos repudiandae quos saepe. Quaerat adipisci velit fugit omnis sit earum. Consequatur nobis tenetur aliquid. Ut dicta quia consequatur. Nam et eveniet reiciendis rem eaque voluptatem. Totam aliquam reiciendis laudantium dolore eaque. Aut ut occaecati ipsum. Fugit autem debitis nihil aut. Qui aut rerum dolor tenetur dignissimos id molestiae.,2013-06-09T14:28:35.685Z
513,Sunt sit eum porro cum dignissimos. Occaecati voluptas similique. Dolor exercitationem vitae. Nam ipsam et impedit magni. Dolor voluptatibus et sequi saepe. Repellat architecto distinctio vel. Impedit a ipsa molestiae recusandae corrupti eum. Quae aut harum voluptate corporis. Animi et et nihil quia est tempora. Sed tempore ea qui natus quisquam numquam accusamus iure. Rem eligendi soluta consequatur consequatur sunt alias dolor consequatur.,2016-05-16T22:11:18.851Z
514,Ut non voluptas. Aut sit earum et eos modi. Assumenda maiores quasi aliquid harum. Nisi libero aut vel odit est soluta facere totam. Quo omnis quae aut nulla doloremque. Facere quos et tenetur.,2020-02-27T21:24:41.773Z
515,Optio veniam est soluta ipsam tempore et repudiandae sint. Quia deserunt eaque sapiente. Voluptate deserunt aut omnis eum. Commodi eos sequi sed temporibus animi illum. Ducimus exercitationem quos qui aperiam aliquid saepe. Quas consequatur ut fugit architecto. Laborum velit corporis rerum aspernatur dolor fugit aut. Eum ut laborum accusamus natus eos tempore.,2015-03-06T18:51:27.480Z
516,Expedita quia aut. Ducimus nemo voluptatem ipsa sint eius qui minima. Dolorem blanditiis delectus est et et aut quia. Maxime vel at aut accusantium. Consequatur accusantium eligendi et odio iusto molestias facere earum sequi. Est omnis placeat. Voluptatem consequuntur et consequatur nihil omnis. Aperiam adipisci eos in alias iure numquam blanditiis. Ad tempora praesentium veritatis harum voluptates ratione voluptates aut. Est vel non ut. Rerum rem vel molestiae omnis ipsam eveniet. Dolorem qui atque dolor.,2017-07-09T15:20:24.604Z
517,Occaecati in quisquam dolores modi nam eos. Aspernatur laboriosam beatae iure deleniti adipisci temporibus rem. Iusto cum voluptatem rerum non quisquam nostrum qui expedita. Aperiam vel et voluptas corrupti cumque. Et quas veritatis id. Tenetur eveniet consequatur nobis iste voluptatum. Molestiae id facere nam odit. Hic nam est rem quia ducimus ut dolorem. Ipsam quia sint beatae doloremque. Non unde voluptas eum. Recusandae alias qui molestias quis.,2020-06-07T09:51:00.659Z
518,Corrupti nam sunt omnis. Qui doloribus earum blanditiis asperiores ut consequatur nostrum. Explicabo voluptatem pariatur. Commodi numquam voluptates ut iusto in rerum. Est ut quidem neque placeat eum aut unde. Esse tempore aliquid culpa consectetur sunt incidunt ut vel voluptas. Quis iure excepturi provident doloremque nihil repellat cumque nisi ea. Repellat eum adipisci distinctio provident et debitis.,2016-05-24T13:50:04.973Z
519,Commodi ut architecto error ea ipsum doloribus. Cupiditate et delectus unde non delectus rerum vel. Assumenda qui quaerat quia expedita voluptatibus et dolorem voluptatem. Aperiam harum quisquam. Enim accusantium et labore sed omnis quo sunt eius maiores. Voluptatem a ipsa illo aliquam architecto unde et expedita voluptatem. Voluptatem officiis non earum enim voluptates eos tenetur et. Expedita ullam incidunt incidunt. Est velit eos et ipsa sunt soluta. Aliquam debitis voluptatum laborum explicabo perferendis corporis optio ut.,2011-11-01T09:48:18.504Z
520,Dolor non quas dolore aut in. Tempora nesciunt qui ut laudantium eligendi autem porro in incidunt. Odit repudiandae sed harum cum accusantium in inventore distinctio. Rerum doloribus voluptatibus est explicabo nobis mollitia officiis excepturi. Id quis eaque. Deserunt molestiae atque et minus est. Atque consequatur tempora voluptatem maxime ullam excepturi ea. Rerum dolor qui vero id incidunt excepturi tenetur hic. Corporis qui quis non rerum dolore at. Repellendus mollitia suscipit ab.,2011-01-07T21:52:44.437Z
521,Occaecati iste aut quia omnis adipisci ullam et eius. Praesentium libero expedita facilis id quaerat doloribus aut. Et ad aut id rem maxime praesentium aut provident. Est iusto aut illum. Nobis libero dolores qui facere sed dolorem. Repudiandae veniam id natus magnam aut sequi vitae quod placeat. Autem necessitatibus est. Officia soluta laudantium rerum ea quae nihil aut quibusdam officiis.,2017-02-27T17:20:55.797Z
522,Repellendus a voluptatibus rem aut. In sed dicta ut fugit maiores. Et est vel repudiandae sed. Officia sed repudiandae quod voluptatem accusantium praesentium temporibus amet. Dolore ut eaque rerum temporibus alias odio facere fugit. Praesentium et quia repellat voluptates porro id rerum dicta doloremque. Cumque quibusdam eligendi ea dicta officia quo adipisci vero. Impedit omnis libero dolorem. Hic ut sint consequatur veniam est eligendi.,2017-10-02T04:21:45.041Z
523,Qui debitis natus asperiores sapiente consequatur aut est quod nihil. Numquam tenetur corrupti et aut qui blanditiis. Ipsum omnis ea rerum. Ullam voluptatem id hic mollitia culpa rerum et. Nostrum ea aut itaque eaque libero. Quae id enim labore id rerum doloribus consequatur provident. Ratione in corrupti facere. Quam occaecati est ipsum non qui. Quisquam deserunt expedita vel explicabo assumenda. Ad laborum in ut. Eligendi et culpa qui debitis quidem distinctio ratione mollitia fuga.,2012-09-07T03:48:50.945Z
524,Omnis ullam ipsum harum commodi magnam quod qui magni. Voluptas dolorem in voluptatem necessitatibus animi et enim occaecati. Quo ut et eveniet odit quis. In vero voluptatum non. Molestiae tenetur exercitationem labore eos quae quaerat quidem. Autem est libero quasi distinctio iste debitis. Nulla quae doloribus. Et sint est ab quasi. Dolorum voluptate veritatis recusandae quibusdam dolorem veniam voluptas nihil tempore. Vitae iste est odio.,2013-12-19T12:05:53.179Z
525,Consequatur error voluptates velit velit ex officia repudiandae eos nihil. Saepe cum blanditiis in qui aliquam occaecati aliquam. Ducimus impedit ut nostrum aut illo. Accusantium tenetur a et. Molestias aut odit. Sed dolor eos et. Totam reprehenderit totam. Est dolorem assumenda.,2013-05-14T17:35:57.232Z
526,Ut laborum accusantium temporibus et blanditiis pariatur. Ea illo non. Itaque sunt repellat mollitia neque autem voluptas reiciendis alias. Suscipit quia et quo et excepturi molestias soluta saepe beatae. Quibusdam cupiditate perspiciatis iste sapiente enim fugit amet sunt. Molestiae aliquid vel qui eum. Fugit voluptate quo similique doloremque enim quidem distinctio unde optio. Qui sit possimus.,2020-02-12T11:42:54.846Z
527,Commodi totam qui dignissimos sint voluptas officiis quia eveniet sed. Repellendus minima explicabo adipisci quo officia et explicabo eveniet. Voluptates est in. Ut quibusdam voluptatem numquam perferendis laboriosam nulla. Ut ut reprehenderit aut eos nemo explicabo. Est libero labore dolorem et. Omnis adipisci aut nemo autem vero. Sit eaque nam aut hic sit tempore iusto.,2015-03-16T01:43:23.559Z
528,Accusamus temporibus id. Eos commodi consectetur maiores quae architecto voluptas sunt quas eveniet. Commodi debitis ut quia quisquam et et. Sit quas deserunt eligendi voluptatem repudiandae quas deserunt. Est vitae ut atque inventore facilis amet est non provident. Perferendis et repellat cumque. Ea tempora quaerat illum maiores. Recusandae dolor sequi reprehenderit quo veritatis minus qui natus eum. Voluptatum sint ea eaque quo iusto labore dolor.,2017-01-11T13:12:16.339Z
529,Porro accusamus reiciendis quidem. Consequuntur et placeat culpa nihil consequuntur. Similique excepturi autem nulla maxime at eos nisi illum. Blanditiis autem harum et at quasi. Quia assumenda praesentium. Molestiae error ratione. Quidem non aliquid expedita exercitationem rerum. Architecto reiciendis quo sit sint quae non. Recusandae repellat aut sint sunt laboriosam rerum labore reiciendis enim. Ullam architecto quia sunt.,2012-10-10T01:54:31.749Z
530,Consectetur doloremque praesentium ut. Voluptas laudantium et qui doloribus suscipit fuga. Exercitationem asperiores saepe amet porro doloremque facere. Doloremque magnam dignissimos. Laudantium sapiente dolorem sed. Voluptatem magni cupiditate. Aut nulla inventore nesciunt id aut sunt. Ut voluptatibus explicabo recusandae et quas non ut perspiciatis. Quis voluptatum fugit sint quasi.,2015-05-30T16:53:28.775Z
531,Assumenda ut voluptatum sed corrupti doloribus ex voluptate sint. Eaque commodi nihil fugiat quo illo enim qui illum. Ad suscipit excepturi accusamus aliquid est eum. Labore qui autem culpa eveniet et consectetur. Officiis quia ab architecto magni molestiae. Dolor veniam quos est. Voluptas quaerat accusantium et odit fugiat minima.,2015-10-17T20:33:26.051Z
532,Iure deleniti ipsum in consequuntur quisquam dolor nihil. Nobis nam aperiam. Dolor impedit vero vitae perferendis sapiente dolorum quo. Nam voluptatem vel occaecati corporis. Illo cumque tempora consequatur sed quibusdam qui quaerat vitae. Nihil sapiente modi placeat velit dicta enim cupiditate quis. Ut nisi omnis. Quia deleniti ut consectetur harum. Non sint labore et iure impedit.,2019-01-18T08:39:31.182Z
533,Facere sunt temporibus quasi praesentium quam qui quos omnis. Quibusdam quia dolore eos labore sequi facilis quae quam. Et natus est asperiores qui eos dolorem. Pariatur velit tenetur aut qui. Accusantium molestias expedita blanditiis voluptate voluptate. Ipsum nisi nihil optio molestiae rerum. Quia sint voluptatem adipisci non aliquid explicabo delectus suscipit. Sed qui aperiam quos molestiae quae possimus aut explicabo. Dolores numquam hic omnis dolores eos delectus perspiciatis optio laudantium. Aut inventore ut ducimus eum harum sunt est sit velit.,2013-12-09T16:23:50.140Z
534,Beatae sint hic voluptatem magni aspernatur doloribus. Aut atque nihil autem illo sed maiores sunt sapiente. Est corporis doloremque. Sapiente quia ipsam commodi odio odit aperiam. Et enim aliquid et. Dolorum ea nemo reiciendis ipsum libero. Et ipsam ea dolore odio sequi deserunt voluptatem dolor ea. Illum aliquam eum ex tempora vel pariatur. Sint quis et. Excepturi corrupti dolorem.,2013-12-20T15:05:33.087Z
535,Molestiae pariatur maiores odit enim voluptas dolor. Sunt qui natus adipisci dolore est maxime illo fuga. Nihil ea est suscipit voluptates porro minima laborum ut. Consequatur tempora exercitationem. Rerum exercitationem distinctio consectetur. Autem nulla qui aut. At et iusto dolorum sint eum et animi saepe. Sequi saepe magnam et recusandae ex maxime enim. Quia dolorem voluptas dolores. Corporis voluptatem voluptas repellat optio esse assumenda. Non deserunt sequi debitis inventore corrupti magnam ullam et.,2015-08-26T04:35:10.315Z
536,Quaerat commodi in. Laudantium voluptates praesentium omnis nesciunt sit quis. Nihil eius quod ab saepe. Omnis adipisci quis. Amet amet qui sint quam aliquam vel at quo. Facilis omnis fugit excepturi sed ut corrupti. Aliquam quo architecto officiis minus libero aut ex. Harum et qui.,2013-04-13T05:01:33.680Z
537,Est rerum harum cum et accusamus beatae quidem rerum et. Hic porro reiciendis sed vero dolores aut qui error est. Accusantium impedit fugit eaque quasi enim. Amet quam voluptate nihil. Ea sed ut. Vero saepe est nemo.,2019-12-24T18:27:54.317Z
538,Modi et omnis quod sit sed dolor accusamus. Eligendi officia aut autem accusamus nisi aliquid. Quos quae ducimus eligendi facilis cupiditate ipsa dolore. Accusamus impedit blanditiis impedit ut similique sit quis ab. Soluta dolore sunt aperiam fugit eum. Qui aut sint. Doloribus quidem eos in eveniet ut. Et ipsa molestiae modi quidem deserunt. Quo quia doloremque. Quas odio fuga. Accusantium modi asperiores incidunt dolorum.,2015-12-05T02:25:12.292Z
539,Inventore pariatur culpa enim ex quo quas dolores. Temporibus ipsum nihil corrupti asperiores voluptatem. Harum ea quisquam voluptas neque sunt pariatur nisi qui corrupti. Amet dolor quos animi facere qui harum. Odio praesentium voluptatem eius eius atque placeat. Dolore earum omnis eaque pariatur. Non similique minus. Ut earum et reprehenderit expedita dolorem aut et asperiores ratione. Ea sit porro aut dolores et dolores officia. Magni deleniti quia amet corporis ut nemo quisquam beatae. Quo animi animi illo necessitatibus illo quia id est. Temporibus incidunt at sed.,2012-07-10T10:15:20.024Z
