id,descriptions,release_date
244,Esse dolorum sequi. Voluptatum cum repellat fugiat atque alias rerum ea iste repellendus. Ut dolore qui et veritatis. Est nam nam et enim sit a libero. Inventore quia maiores pariatur iste eos quis modi. Dolorum quibusdam rerum sit. Quia aut fuga est exercitationem molestias quod saepe suscipit. Aut impedit illo mollitia necessitatibus et id. Laudantium deserunt aut fugit omnis quis et blanditiis autem quam.,2020-05-05T20:22:08.555Z
245,A molestiae quas sapiente. Commodi dolorem et vel quia beatae consectetur nihil saepe. Pariatur accusantium qui ratione qui est est soluta sint. Inventore deserunt sapiente odit praesentium culpa ut. Sit modi aut maxime et illo. Labore laboriosam voluptates nisi molestiae blanditiis quia. Nostrum minus a voluptatem nemo veniam voluptatem quia. Autem aliquam quos aperiam beatae.,2020-04-03T03:02:24.812Z
246,Aut non a corporis. Numquam facilis debitis sit. Dolor debitis architecto sunt maiores ab atque. Vero et tenetur impedit voluptas consequatur quam. Et placeat et et repellendus dolores est libero pariatur ut. Corporis facilis repudiandae. Dolor enim repellendus ducimus soluta aut. Amet velit accusamus soluta et id atque praesentium quia consequatur. Aut tempora dolore eos facilis corrupti ut est tempora laborum. Aliquam neque et qui veniam magni. Maiores voluptas eius placeat qui veniam eveniet ad.,2018-11-03T19:03:17.947Z
247,Asperiores adipisci ullam repellendus recusandae consectetur aut. Tenetur pariatur adipisci voluptatibus fugiat quos repudiandae. In necessitatibus qui ratione quasi natus. Quibusdam optio veritatis ut quas in qui vel quia sequi. Nisi nostrum qui porro et et beatae omnis est magni. Atque dolorum aperiam sit praesentium nobis magnam incidunt corrupti eveniet. Laboriosam sed vitae. Suscipit voluptatem assumenda. Cupiditate voluptatem id unde quisquam voluptatibus eos.,2015-04-28T10:25:51.722Z
248,Ratione in occaecati voluptatem. Quos beatae quia ut tenetur qui. Quaerat quibusdam voluptate recusandae veritatis esse. Et nulla non. Ipsum nam est laudantium blanditiis est magni est. Sed quia nobis est et placeat eius et. Nemo soluta aut eveniet. Et dolorum nostrum ut saepe pariatur. Et et placeat sint. Optio laborum cumque quia dolorum rerum nisi ut error.,2018-05-07T04:25:41.733Z
249,Eaque vero culpa qui accusantium delectus. Unde debitis corrupti quo corporis culpa rerum. Et soluta sunt est. Ipsa aut eligendi ipsa. Saepe cumque dignissimos quo praesentium qui. Ipsum enim ipsam omnis est dolore atque qui eos recusandae. Error ratione quia magnam maxime non sed in. Quidem voluptatem ut fugiat nihil. Voluptas voluptas quia natus. Quidem laborum incidunt velit. Hic sunt laborum minima molestiae magnam. Ipsa dignissimos saepe quisquam debitis asperiores perspiciatis autem rerum consequatur.,2013-02-06T11:51:41.252Z
250,Architecto vel asperiores deserunt aliquid deleniti incidunt laboriosam. Tenetur corporis inventore ipsa placeat fuga qui est. Voluptas veniam dolores consequatur. Eveniet aut quidem temporibus pariatur nesciunt sunt ea. Ut qui voluptatibus totam qui labore incidunt quis assumenda reprehenderit. Ea et quia sit qui. Et et minima alias velit. Tenetur sit minima a sit repellendus nihil occaecati autem a. Odit expedita qui veniam qui quae eum vitae.,2019-06-17T13:49:25.791Z
251,Et aliquam repellendus consequatur. Commodi facere ut necessitatibus sint dolore non. Placeat omnis recusandae vel iure modi veniam veritatis. Soluta a voluptatum qui aut. Deserunt est commodi recusandae ex nesciunt reiciendis. Voluptatem voluptas laborum corporis et consequatur. Et id magnam velit velit minima.,2016-11-14T09:42:04.744Z
252,Id consequatur eos rem quas. Sed odio ea corrupti libero labore enim quae alias. Incidunt vel quasi fugit provident in illum. Et eum praesentium possimus voluptatem ut ratione voluptatem porro debitis. Dolores ad eos reiciendis aut laboriosam. Minus ut eum id dolorem ducimus molestiae molestiae. Dolore soluta nihil qui dolores. Eligendi qui recusandae sapiente architecto quia dolor.,2011-07-18T02:32:25.116Z
253,Dignissimos facere qui laboriosam rerum. Alias ut voluptatibus deserunt sit quia debitis. Maiores quo beatae ut a consequatur. Ea ex saepe ea voluptas dolor cupiditate maiores. Placeat laudantium sit qui est laboriosam officiis. At at deserunt impedit accusantium et non dolore iure corrupti. Voluptas modi at. Tenetur numquam dolore eaque veritatis molestiae. Et aspernatur quo.,2016-07-27T12:28:15.908Z
254,Quasi veritatis explicabo totam ut temporibus id reprehenderit. Commodi ut non dolorem sequi non quod. Voluptatibus voluptatem maxime sed eveniet debitis et ut. Molestiae iusto nihil aspernatur ab odit. Consequatur quia dolorem doloremque consequuntur quaerat molestiae minus distinctio. Quam magnam non tempore quis ipsum eos sint ducimus voluptas. Nulla quisquam eum repudiandae molestiae dolorum sint. Nihil repudiandae et. Nihil iste exercitationem corporis occaecati quia consequuntur rerum saepe distinctio.,2015-08-22T18:08:46.474Z
255,A rerum voluptas sed vitae quasi sit saepe. Itaque modi nulla cum animi autem. Labore libero alias. Corporis omnis quia nostrum quia eos culpa eligendi est nesciunt. Quis impedit vel ex. Rerum debitis hic voluptas dolores ullam aut. Voluptatibus sapiente quibusdam. Est architecto dolorum quo. Ullam tempora ab sit ducimus soluta excepturi ex ut. Expedita et voluptas provident.,2012-08-07T06:02:34.728Z
256,Qui veniam voluptatem illum. Esse incidunt earum officia. Cupiditate libero eos dicta inventore quae corrupti. Voluptatum qui sed ut. Ratione est aspernatur ipsam sed natus autem libero. Et eveniet dolorem. Suscipit enim dolorem eius.,2018-04-16T15:40:07.424Z
257,Veniam maiores vel quia fuga corporis et eum provident excepturi. Est atque omnis non laudantium. Quia et optio. Facilis inventore natus voluptate et et molestiae blanditiis veniam. Ullam quia inventore iste aut ut. Occaecati accusantium est. Dicta quis inventore. Consequuntur sit ipsum molestias sequi. Ea ad possimus suscipit quas. Hic aliquid rerum vero saepe dicta quia. Id quia non accusantium laborum eaque.,2011-02-06T22:09:01.363Z
258,Veniam cupiditate eum quia quo eligendi architecto aut. Animi expedita ut ipsam. Odio sint inventore recusandae unde. Ullam voluptate quam omnis qui iure velit voluptatem. Odio et aut sit. Earum quos commodi illum possimus ducimus maxime quas vero dolor. Adipisci voluptatum voluptas voluptatem. Ut laboriosam iure ut quia eum explicabo rerum eos dolorem. Consequatur provident repellat.,2017-12-06T00:05:35.504Z
259,Voluptas cum nam dolore vel ipsam eligendi sed deserunt sit. Pariatur nam et. Quidem vel quidem. Repellendus laudantium voluptatem. Possimus consequatur minus possimus itaque. Nihil qui reiciendis voluptatem corporis unde suscipit quidem perspiciatis. Aut natus corrupti aut ipsam repellendus est animi libero. Quia inventore sit fuga maiores cum officia qui sit. Recusandae magnam nemo ut at.,2018-02-23T03:01:00.219Z
260,Et et eligendi dolor aut. Sit est libero quae. Delectus minima at. Error qui consequatur optio. Ad aspernatur aut velit quaerat ipsa numquam dolor. Delectus atque dolorum sint. Et eum quo sed ut. Voluptatem non consequuntur in sit.,2016-10-29T01:41:42.480Z
261,Velit accusamus eos aut laborum. Aut consequuntur quos qui mollitia aut. Maiores qui neque voluptatem aspernatur. Nobis laudantium nulla quis consectetur et deserunt ullam cum. Beatae ut quo impedit. Qui repudiandae est et minus iure recusandae. Harum aut occaecati et enim consectetur vero quia eos. Rerum adipisci consequatur quidem tempore commodi.,2014-11-30T11:46:05.505Z
262,Porro voluptates nihil praesentium aut quia in ut. Magnam maiores aliquam sequi esse qui voluptatem hic. Itaque dolores impedit velit tempore. Consequatur illo libero et. Ut accusantium ut. Quia officia officiis non sunt quia in doloribus.,2019-10-26T17:50:54.827Z
263,Aut in repudiandae. Sapiente sit neque cumque. Animi reiciendis velit ratione saepe non. Dolore mollitia nobis nostrum. Rerum consequatur odio qui ullam. Numquam culpa ut soluta aut. Aut dolorem perspiciatis necessitatibus. Voluptatem expedita distinctio porro consequatur ab sunt ab. Velit fugit ut.,2020-04-29T05:10:18.415Z
264,Fuga recusandae ab alias. Ea qui qui repellendus autem reprehenderit ut. Sequi voluptatem quam impedit fugit expedita cupiditate. Quo iusto dicta repellat. Facere praesentium molestias est. Debitis consequatur aspernatur necessitatibus rerum libero incidunt. Facere qui optio in quaerat nobis et accusamus a. Ut eos voluptate nihil iste est facilis. Ad quae perferendis et ipsam. Architecto dignissimos doloremque.,2015-12-17T02:58:03.959Z
265,Praesentium odit voluptatum quis quia rerum est nihil alias sit. Sunt mollitia qui quod assumenda et sit harum similique. Consectetur esse soluta ratione est tempora debitis aut maiores. A voluptatem et dolorem minima aut. Praesentium laborum officiis dolore omnis perferendis et eos id nihil. Hic sed eaque nihil esse quidem quis omnis et aut. Id veniam est. Incidunt quis sed ullam vero odit dolorem est. Eum repellat alias blanditiis accusamus porro.,2020-02-04T07:38:55.932Z
266,Ea non aliquid odio est et. Earum aut unde. Ad qui veritatis ea ut fugit. Velit maxime nostrum. Velit est aspernatur autem repellendus natus tempore. Maiores necessitatibus itaque cum.,2012-01-07T15:43:41.796Z
267,Itaque est commodi voluptatem ut porro cupiditate sit. Quo eos sint natus eligendi rerum asperiores fugit. Perferendis eligendi quia. Vitae alias aliquam. Placeat dicta asperiores nostrum amet ipsum sed minima ad facere. Perferendis sint dolore repellat repellat. Enim consequatur et voluptates et dolorem. Quis voluptas atque soluta totam. Voluptatibus nobis numquam porro dolores fugit. Ut explicabo sequi quam deserunt debitis nobis non. Eius alias aut repellendus atque deleniti.,2013-05-25T23:31:39.646Z
268,Omnis repudiandae non exercitationem repudiandae sit ea modi nisi molestias. Consequatur non eos harum corrupti. Commodi qui aut recusandae a molestias fuga. Hic nam animi non voluptatem voluptatem fugiat quidem et. Sunt exercitationem qui aliquid quo deleniti officiis sit esse necessitatibus. Voluptatem quod omnis in vel quisquam illo recusandae et omnis. Ut quia beatae quisquam. Nam quos odio voluptatibus. Quia rerum et placeat repellendus.,2011-02-02T02:23:50.746Z
269,Et odit autem qui corrupti ducimus. Est voluptate ab. Quam sed eius est vel eos accusamus. Sit ut dolores temporibus voluptates rerum harum. Nam cum sed id earum debitis quia occaecati voluptatibus et. Nam ab qui quasi eligendi velit itaque. Autem non blanditiis quisquam consectetur ea illum ab dolorem. Exercitationem aut sit eaque quibusdam qui vel ut explicabo reiciendis. A qui alias sint nemo eveniet et accusamus.,2014-11-06T15:24:38.948Z
270,Rem cumque qui iste fugiat. Cum iusto quia velit. Voluptatem temporibus repellendus et praesentium fuga nihil placeat ab a. Est nihil eveniet. Qui nostrum ut nam sed. Unde animi impedit aut vitae dolorem voluptate necessitatibus deserunt consequatur. Qui voluptate debitis id mollitia vitae. Id inventore iste dicta et magnam nam minus sunt cum.,2010-09-05T12:53:42.499Z
271,Ipsam labore eius corporis ut modi quis omnis. Harum vel cumque aliquid cum aut ipsa. Similique et labore itaque magnam quam facilis eaque qui eius. Sequi harum enim. Occaecati voluptatem repellat iusto alias praesentium pariatur id. Quo ipsum omnis et esse rerum repellendus corrupti dignissimos earum. Accusantium aut id debitis harum. Sapiente omnis suscipit ab necessitatibus est nihil eum. Sit labore officiis voluptate odit iusto et amet voluptatibus eum.,2014-07-06T19:29:56.210Z
272,Inventore sed dolor quia culpa nulla. Cumque itaque rerum. Qui corporis assumenda dolorum ullam aut omnis minus ut. Sed qui sed. Hic saepe ut aut iusto dignissimos et. Ad natus ut quos aut architecto est libero ratione non. Tempore quasi et laborum hic consequatur qui numquam. Cum sed voluptate. Magni ut omnis minus omnis modi minus. Voluptatem rerum vel dolorem.,2014-03-07T01:24:54.401Z
273,Dignissimos perspiciatis molestiae cumque possimus et iusto non consectetur. Ea quas culpa aut nihil hic et. Tenetur voluptates similique tenetur id eaque aliquid. Et qui ut sunt delectus similique eveniet dolores. Eos placeat totam similique. Debitis doloribus aperiam. Illum consequatur eveniet natus. Modi et qui saepe blanditiis. Hic magnam sit laboriosam.,2017-02-01T12:02:14.722Z
274,Rerum sapiente unde asperiores non. Non similique quia qui ullam voluptates dolores molestiae. Fugiat quidem officia. Nisi quos debitis similique adipisci corrupti porro. Distinctio velit deserunt odit quia. Quia occaecati autem. Enim vitae sunt nesciunt voluptas facilis ad voluptatum. Quos occaecati accusamus eum blanditiis quidem aperiam. Harum dolores neque sed iure nihil eos et. Voluptatem ducimus et aut mollitia et eaque consequuntur cupiditate.,2014-10-13T04:57:05.258Z
275,Ab consectetur dolorem sunt aperiam corporis quis neque quaerat. Nostrum odit totam quos occaecati iure beatae error veritatis. Mollitia dignissimos in qui aut. Iusto alias rem dolorem maxime autem distinctio eos repellat. Ut fugiat quod pariatur error quia qui suscipit iste. Sint assumenda est. Quis recusandae ad mollitia sapiente sed quas vero rem quis. Nam est maiores qui sequi consectetur. Voluptatum perferendis architecto inventore sit saepe minus et qui. Quis non cumque sunt fugiat amet modi ut. Dolorem placeat repellat et harum rerum voluptatem quo.,2013-08-20T16:51:27.769Z
276,Nobis impedit eos et facilis. Debitis quia autem qui aut fugit quidem eum odio architecto. Ab officia explicabo aspernatur accusantium facere. Animi consequatur aut deserunt. Sint aut et aut dolor nihil eos qui architecto provident. Quibusdam facilis consectetur a temporibus laboriosam dolorum et et aliquid. Nostrum qui nesciunt et beatae. Aspernatur quos voluptatum. Sit natus molestiae laborum autem repellendus facilis.,2019-01-10T05:31:24.216Z
277,Est nemo perspiciatis exercitationem earum commodi odio et. Recusandae voluptatem non maxime. Quia placeat aliquam fuga illo omnis et. Consequatur laboriosam modi. Voluptatum occaecati aliquid facere et dolore. Earum deserunt ipsum deserunt qui sit repellat molestiae. Doloribus provident temporibus. Quis reiciendis exercitationem libero non sequi et deserunt nam.,2014-07-05T05:33:35.244Z
278,Ab et optio aut perferendis voluptatem non consequatur animi. Consequatur nulla dolorem eum laboriosam quo saepe. Aut omnis eaque odit et. Iusto repellat ullam dicta facere facilis corrupti. Alias ut esse consectetur nam ab et pariatur et animi. Dicta labore officia qui libero ut officia voluptatem nemo voluptatem. Officiis aut voluptatem expedita culpa nisi. Harum veniam dolorem repudiandae fugit cupiditate rerum quibusdam ea. Veniam perferendis maxime enim sequi qui modi. Consequatur consectetur aliquid qui soluta deserunt doloribus.,2017-12-18T23:42:38.796Z
279,Ad explicabo ratione atque voluptas totam. Animi voluptas explicabo. Rerum ipsum rerum est enim minus exercitationem commodi. Ut adipisci debitis. Placeat harum sunt et consequatur omnis odit et unde impedit. Impedit voluptas harum. Quaerat minima amet modi aut. Doloremque quasi necessitatibus reiciendis odit esse deserunt. Dolor sunt labore est ullam earum.,2011-04-25T04:36:39.060Z
280,Suscipit nisi quos architecto facere iusto vero modi impedit. Soluta repudiandae deleniti porro facere corrupti asperiores. Nihil vel velit harum amet necessitatibus. Dolorem tempore et porro enim facilis natus laborum aliquam dignissimos. Deserunt sed non. Sed ab debitis ut accusantium voluptatum. Unde excepturi incidunt omnis ratione quia. Quaerat sit officia repellat facere quaerat neque.,2015-11-14T01:03:53.945Z
281,Illo magnam illo. Velit quam minima est. Perferendis ut quisquam aut. Totam eos praesentium quisquam delectus porro exercitationem consectetur sunt. Quam velit sed ipsam ipsam ut voluptatum consequatur qui. Impedit nostrum sed quam natus quidem beatae sit et.,2012-08-28T10:48:39.236Z
282,Deserunt nobis necessitatibus nihil. Repellendus iure illo cupiditate reprehenderit. Voluptatibus omnis at recusandae et dolor est quia quae ut. Et sapiente magni odit quo dignissimos quos dolores esse eligendi. Quos rem dignissimos eveniet similique rerum. Enim provident rerum labore soluta nihil. Magnam ducimus nihil minus rerum minima.,2018-07-31T05:41:28.896Z
283,Nisi sed impedit aut eos et laudantium suscipit aspernatur. Voluptatem maxime deleniti quam blanditiis est et. Vel omnis laboriosam nam quia corrupti officia laudantium eius eum. Aperiam placeat libero eaque occaecati. Commodi suscipit qui libero voluptas accusantium pariatur explicabo consectetur fuga. Quod autem labore labore quia sed tenetur qui sint. Sunt impedit aut est et voluptatem autem necessitatibus et architecto.,2011-07-30T05:33:49.945Z
284,Veniam consequatur necessitatibus. Beatae fuga molestiae nobis nobis odio ad. Quam vero qui numquam alias tempora recusandae. Minima repellat earum enim maxime illo repudiandae sit atque voluptas. Exercitationem non nihil dignissimos iusto officia ut nihil omnis omnis. Porro vel aut. Pariatur quibusdam quod. Quo accusamus natus. Alias itaque quam enim in vel consequatur. Et saepe nemo nemo odio deleniti beatae aspernatur.,2010-11-03T23:27:01.974Z
285,Cumque reiciendis architecto quibusdam porro et quia ut. Quis architecto omnis tenetur asperiores nihil corrupti vitae nesciunt. Iure atque officia est provident possimus. Ullam vero eum voluptates laudantium assumenda facilis enim. Repellat enim nam numquam et sit quae. Asperiores blanditiis aut sint error.,2014-08-06T19:54:49.267Z
286,Perferendis maiores perspiciatis consequatur dolor qui dolores. Ut unde enim officiis. Voluptatem ut aut pariatur. Laborum fugiat laborum deserunt ut. Quod omnis qui distinctio. Ea et iure officiis. Vel ea omnis. Minima est iusto et. Minima eum dolores atque temporibus quidem iste et. Possimus necessitatibus reprehenderit. Autem minima a et sequi voluptas consequatur distinctio quo.,2018-08-21T11:54:15.791Z
287,Et ut et ea iusto veniam debitis rerum quo est. Laborum dolorum accusantium. Provident et quos minus dolor esse. Inventore adipisci modi provident aspernatur et cupiditate. Quidem sit nihil et molestias consequuntur cumque. Deserunt eos laborum iste quia aliquid incidunt rem nulla. Provident rerum repellendus magnam. Quibusdam omnis et asperiores accusantium sunt. Velit explicabo facere praesentium.,2020-03-02T01:30:35.868Z
288,Praesentium amet voluptate nemo expedita qui incidunt. Iusto dignissimos dignissimos maxime voluptatem deleniti officiis unde. Atque et cupiditate cupiditate aliquam natus fuga. Ea veritatis quaerat dolores quo odio ut architecto numquam. Harum commodi provident officia dolore. Laboriosam alias et tempora. Nostrum nostrum voluptate quis. Voluptatum qui et modi aliquid quia aut cupiditate voluptatem.,2014-06-28T19:35:46.444Z
289,Quo ex provident facere soluta velit placeat. Quo corporis itaque ab quasi dignissimos et sed recusandae nobis. Possimus quia labore expedita magnam nulla quia voluptatibus voluptate. Fugiat qui ea atque a itaque et. Molestiae esse saepe eos voluptatum tenetur quos. Iste fuga in. Culpa eaque veritatis. Tempora inventore tenetur consectetur ut deleniti magni. Harum nam alias. Aspernatur illo et et. Ipsam unde facilis quidem ut.,2017-03-04T03:20:52.755Z
290,Sit est atque quisquam ipsam eos adipisci animi. Ullam aspernatur ratione magni et. Quis soluta expedita est quo repellendus sit. Perspiciatis est eaque tenetur. Quasi at adipisci vitae ut aut et maxime repellendus. Voluptatem tempore sint. Amet voluptas voluptas occaecati repudiandae quae. Voluptas commodi autem porro aut explicabo id inventore. Omnis aut quidem nemo quibusdam eius incidunt et.,2014-06-14T06:14:15.121Z
291,Tempora voluptatum magni et praesentium molestiae dicta aliquid dolores. In similique facilis sed blanditiis enim excepturi quia modi. Molestiae quia exercitationem sunt. Temporibus qui rem facilis. Recusandae consequuntur cum maiores dicta temporibus sint id et. Reprehenderit possimus totam nemo nesciunt magni voluptatibus sunt. Soluta aliquam quibusdam omnis qui vel deleniti laborum mollitia laboriosam.,2017-11-12T20:38:03.385Z
292,Delectus accusantium non voluptatibus. Sapiente voluptas quia tenetur. Praesentium natus nam in non voluptatem nesciunt. Quisquam quisquam dolorum amet at amet quidem sequi eius. Cumque earum eos quis. Consectetur explicabo et vero rerum sed. Voluptas mollitia excepturi eligendi quia et qui doloribus rem. Magni qui sed recusandae amet sapiente non facilis hic dolorum.,2016-08-05T16:47:00.185Z
293,Enim sit omnis ut voluptas qui. Maiores cumque quos nisi veniam et aperiam ullam dignissimos. Voluptate commodi iure sed maiores ab autem voluptatem maiores cum. Adipisci quam est. Libero iste culpa dolores dolores. Qui inventore dolore occaecati deserunt deleniti dolores. Ad vitae rerum eos et vitae provident veniam.,2014-03-03T17:56:54.331Z
294,Assumenda quae odit eos rerum dolore alias laborum architecto hic. Corrupti voluptatibus rerum numquam consequatur itaque enim at est accusamus. Tenetur quia nobis consequatur. Praesentium ea rerum est esse in. Quis cumque tempora accusantium praesentium temporibus aut quidem rerum doloribus. Temporibus minus voluptate. Quidem est et et.,2017-01-22T16:42:30.711Z
295,Deleniti natus quo. Deleniti reiciendis ad quas labore numquam incidunt atque. Repellat et cum vel soluta quia voluptas veniam illum ea. Dolores laboriosam quibusdam veniam explicabo animi tempora nulla dolorum velit. Vitae impedit magnam. Voluptas sit sed expedita harum alias eos autem. Provident necessitatibus itaque atque reiciendis sequi illum veritatis.,2019-06-18T19:58:56.726Z
296,Vel aut eos ut ut corporis. Laudantium odio voluptatem accusamus quis aut ut laboriosam totam assumenda. Libero quia voluptas voluptatem et et aliquid. Id pariatur eligendi eaque deleniti doloribus facere. Neque animi voluptas ipsam id fugit aliquid. Esse eos eum iusto vel qui aliquam ratione velit. Sit dolorum quaerat at debitis ipsa aut omnis error. Quia voluptates vel ut qui illo ipsa sequi laborum magnam. Ex quidem vitae id. Veritatis exercitationem quod quidem dolores accusantium aspernatur maiores voluptatibus.,2014-01-27T00:43:16.849Z
297,Et quo molestiae vitae optio aut totam dolore dignissimos atque. Temporibus vero laboriosam veritatis reprehenderit cumque consequuntur porro quasi. Molestiae earum placeat voluptatem nesciunt optio ut fuga exercitationem. Voluptatem odit qui dolorem exercitationem commodi similique accusantium non perspiciatis. Ad reiciendis et voluptatibus blanditiis nemo deserunt. Sequi et quo ipsam voluptatibus aperiam maiores omnis. Numquam eum ut qui quis reprehenderit veniam. Voluptatem sapiente cumque maiores ex enim. Adipisci sed quasi omnis.,2010-11-05T11:25:27.103Z
298,Non officia sed reprehenderit cumque perspiciatis et magni exercitationem. Placeat quo nesciunt architecto voluptatem. Quibusdam expedita amet perspiciatis amet illum cumque id quidem et. Sapiente sed voluptatum inventore magnam omnis. Ut nemo ex temporibus et assumenda aliquid laborum. Quo hic est. Assumenda dolores officia nihil quidem quia aut ut accusantium ea. Reiciendis eveniet similique optio eligendi ducimus quia occaecati est aperiam.,2010-11-30T19:21:31.616Z
299,Ea odit sit illum enim optio quibusdam numquam eaque. A maxime sed facere impedit. Fuga maxime est et ut voluptatum. Nesciunt et voluptatem qui eos. Accusantium recusandae id dignissimos qui alias facilis. Voluptatum nulla a. Qui neque voluptatibus rerum repellendus et tempore.,2014-01-09T04:32:22.217Z
300,Quo ex explicabo ea consectetur eum corporis ex. Illum numquam inventore nostrum est dolor. Est eos molestias est. Quia deserunt labore necessitatibus vel voluptas consequatur temporibus sunt. Quam quidem inventore aut facere inventore expedita cumque autem. Vero iusto pariatur at consequatur doloremque asperiores fuga. Error et est itaque dignissimos. Facere illum aut. Sed quis maxime. Quia magnam asperiores eius ad hic qui pariatur. Et aperiam eum odit ex qui consectetur sit ab.,2014-02-11T11:18:07.488Z
301,Unde eaque possimus ullam in qui eum dolor et. Doloribus nulla necessitatibus cumque animi. Et quod voluptas in tempora quas repellat. Libero cupiditate corrupti beatae laboriosam soluta et quisquam sit. Autem et illo. Qui id velit sunt. Animi nesciunt possimus ullam nemo. Magni repellat eligendi. Omnis blanditiis consequuntur. Qui commodi possimus et sed amet rerum.,2012-12-22T01:50:14.818Z
302,Qui quia et perspiciatis molestias. Laboriosam natus odio nulla eius non quae illum atque dolor. Deleniti aut enim ullam aut sit non. Ea quis recusandae et. Quod voluptates sit vitae eaque harum quo ut. Explicabo enim asperiores illo at provident voluptatibus numquam eligendi et. Accusantium consectetur eos est ut delectus itaque. Fugiat laborum eum quas suscipit et eos beatae quod. Ex laudantium rerum saepe voluptatum. Quia sapiente in. Pariatur magnam eos corrupti repudiandae.,2012-03-19T23:51:10.799Z
303,Iure sunt quisquam. Error in ab enim perferendis enim nam est eligendi est. Deserunt dignissimos facere sequi reiciendis eaque tempora. Non esse odio similique molestiae sunt laudantium veniam. Debitis aut recusandae et. Aut enim autem ab. Sapiente totam error facere voluptas accusantium sunt dignissimos voluptas. Eveniet aut est ullam quam eius ex quia sed maiores. Aut cumque perferendis molestiae et autem voluptatem sit ea eos.,2011-08-15T01:20:46.006Z
304,Beatae velit ducimus dolores beatae modi. Cupiditate et et. Et at eligendi. Rerum nobis quo. Eaque sed temporibus odit vel. Corporis fugiat ut sit explicabo itaque voluptas dolore aliquid expedita. Dolores eius et aut. Et tempora aut et. Ullam praesentium eos molestias impedit corporis voluptate est eos.,2014-06-05T23:06:45.493Z
