id,descriptions,release_date
1,Nam eligendi dolorum ullam nesciunt quaerat nostrum. Et eveniet inventore quasi iste voluptatem et iste. Quibusdam hic qui aspernatur aut sit tempore rem rem. Id repellendus voluptate ullam ea placeat saepe eveniet aut repudiandae. Quae temporibus pariatur architecto consequatur maxime provident sunt provident pariatur. Eaque nisi sapiente omnis culpa a incidunt necessitatibus. Quam nostrum omnis dolorum quod.,2015-12-27T00:21:27.096Z
2,Quaerat et iste accusamus aut ab dolorum. Blanditiis quia enim impedit. Dolor fugit hic. Voluptas dolorem sint atque quis velit quod. Vero velit id voluptatibus ipsum. Sint error in inventore sit omnis sed iure. Nostrum minus est. Architecto tempora rem ratione rerum molestias. Eligendi commodi maiores alias. Odio tempore pariatur expedita aut.,2017-09-12T12:07:29.091Z
3,Quidem fugiat aut et cum beatae. Sint asperiores est ad quos. Sit suscipit qui dolor ducimus nulla. Optio sunt illo maxime minus. Omnis earum itaque tempora vitae. Ratione iusto et laboriosam dolorum. Officia quia et reiciendis asperiores blanditiis.,2013-02-23T21:50:49.266Z
4,In est deleniti. Iste laudantium libero. Dolor est nostrum officiis dolore. Fuga praesentium beatae quidem quis minima consectetur. Qui ea perferendis amet maiores est perspiciatis. Voluptate distinctio et occaecati nesciunt cum. Qui harum non quae explicabo minima reprehenderit est vitae. Vel quisquam illum voluptas.,2017-08-18T17:38:55.775Z
5,Rerum molestiae soluta. Inventore possimus hic ipsum eum facilis veniam velit fugiat perspiciatis. Commodi est sed illum porro rerum sint. Sit nesciunt iure sapiente quis voluptatum esse itaque. Maiores magnam consequatur in nihil dolorem hic. Quidem autem praesentium voluptas optio. Vitae repellendus similique in. Quia vero quia aliquam nostrum dicta quibusdam in consequatur. Labore eius eum.,2013-07-19T18:14:18.025Z
6,Asperiores impedit ducimus corporis voluptatibus. Quia dolore at ipsa cum ea eius cumque est et. Et inventore voluptate sapiente quis dolores. Rem beatae architecto hic fuga qui dolorem assumenda. Aut unde aut est quaerat neque mollitia consequatur molestias. Veritatis et animi consequatur quo quidem. Ex eius provident odio accusamus veritatis. Aut nobis quidem id adipisci sint dolorem ullam. Consequatur sit qui. Praesentium aut ea et deserunt. Autem aut earum impedit est aut dicta aspernatur.,2015-04-17T21:57:33.464Z
7,Dolore voluptatum modi earum qui nemo. Blanditiis itaque consequuntur fugiat assumenda accusamus. Animi quae inventore iure. Deserunt eveniet consequatur voluptas. Molestias dolores sit ducimus maiores nemo ullam consequatur quo. Possimus aut et sint voluptatem et earum porro. Veniam qui expedita exercitationem tenetur totam nulla voluptas aut. Culpa et voluptatem atque necessitatibus officia alias corporis qui. Vel enim aliquam totam illum delectus deserunt tenetur. Sed et et eius aperiam. Nemo vel ipsum quia quia enim. Harum natus iste dolorem corporis repudiandae ratione doloremque fuga.,2016-03-22T14:16:45.453Z
8,Et sit sit culpa possimus in nostrum. Voluptatem itaque sit et ducimus est sapiente. Hic suscipit ut provident accusantium dolores tenetur est. Reprehenderit ea nostrum facilis voluptas distinctio enim. Quia alias repellat eius. Est et distinctio est ab quae modi exercitationem beatae soluta. Ut consectetur non. Culpa eos voluptates nulla deleniti adipisci est enim voluptas. Qui rerum veritatis saepe dolorem quos provident. Neque illum quia molestiae sit.,2019-10-10T18:54:09.225Z
9,Aliquid minus voluptatem velit modi rem molestiae quo amet. Facere quam ullam et neque. Nulla minima repudiandae quia voluptatem qui rerum ipsam. Dolorem et nihil. Error deleniti adipisci ut voluptatem praesentium ut est asperiores. Voluptatibus ut neque non quibusdam voluptates et. Recusandae commodi sit. Vel repellat quo perspiciatis natus eligendi excepturi rerum vel ipsam. Aut consectetur unde et.,2017-02-09T18:15:08.635Z
10,Autem consectetur cum necessitatibus eos est. Occaecati vitae ut reiciendis et quis illo tempore. Culpa perspiciatis rerum quis. Cupiditate hic qui voluptatibus libero inventore consequatur omnis ratione. Ullam sed dolor modi et ut praesentium. Aliquam voluptatem laborum amet nihil suscipit expedita. Vero minima et ad eum nesciunt cumque nam. Modi magni sint consectetur dolor nihil sint accusamus sed.,2015-01-02T04:29:07.994Z
11,Soluta quibusdam aut non ipsum tenetur ea cupiditate animi. Numquam cum veniam non non. Deserunt sint adipisci velit aut porro unde. Officiis laborum tempora est sit soluta sed. Nam magni ducimus suscipit eum. Autem rerum vel magnam vel autem aut consequatur. Itaque voluptatem asperiores illo dolorem ut ut veniam illum. Dolorem nulla laboriosam iusto deleniti. Itaque quidem officiis.,2012-12-18T09:39:59.583Z
12,Perferendis autem vel quaerat. Autem ut saepe enim ad minus repudiandae voluptas. Eos modi corporis nulla sint harum quos esse vero quas. Soluta consequatur molestiae ab. Nostrum et ut voluptatem doloribus. Aut repellat maxime saepe et quo culpa. Non harum tempora dolor fugiat ut eum eum et delectus. Molestias beatae natus sed voluptatem. Accusantium asperiores qui. Itaque dolores quos illum corrupti commodi.,2014-08-02T08:01:36.709Z
13,Placeat ut porro expedita repellat eos temporibus officia officia. Est quidem sed excepturi et. Dolor qui non soluta fugit eos. Est tempora reiciendis optio aspernatur commodi velit ut quam dolor. Tenetur qui dolorem. Et perferendis quos vel odio magnam magni corporis laborum. Modi deserunt quis natus explicabo officia dolorem vitae impedit. Natus maiores quasi facere et sit temporibus cupiditate tenetur. Autem a sed et et labore.,2015-10-23T05:23:23.207Z
14,Incidunt quod eius omnis eos laboriosam accusantium nam. Ducimus qui ratione dolorem voluptatem. Tempora dolores aliquid quos nihil eum impedit illo. Et et et et. Aut aliquam nemo aspernatur laudantium cupiditate cupiditate qui et. Suscipit ut omnis qui. Est ut nihil quidem alias distinctio soluta autem quod maiores. Et aut aut sit sit tempora.,2014-12-02T11:33:23.373Z
15,Eum officia aut rerum quis amet consequatur et. Voluptatem quo ipsa nihil. Tenetur est atque eius a sit tempora sit. Animi sint et tempore ut quia eum placeat repellat. Voluptas a inventore. Provident ipsum veritatis perspiciatis repellat in et eveniet laborum. Aliquam natus veniam. Ut voluptas velit consequuntur asperiores aut pariatur facilis quia. Expedita nostrum ex tenetur maiores accusamus itaque cumque.,2019-02-15T06:08:33.391Z
16,Provident est qui qui. Dolore quasi placeat quae ut ut. In ut debitis rem quisquam et maiores rerum nihil et. Eveniet incidunt vel non distinctio eius. Id ipsa nulla suscipit et. Ut voluptatem aut et sunt. Nobis est culpa possimus quas dignissimos quas voluptatem voluptatum. Numquam facilis neque enim quisquam ullam et sed ea. Asperiores commodi consequatur illo qui quaerat error et placeat. Blanditiis optio labore.,2017-11-30T15:32:19.998Z
17,Natus aspernatur eaque sit. Consequatur voluptatem dolore explicabo. Illum similique deleniti dolore harum voluptatem eos. Explicabo quo quae ut magni corrupti. Aliquam quisquam non qui labore. Dolorem molestiae fuga et natus. Id molestias facere dolor. Non optio at sit eum tenetur minima dolore. Quo vel voluptatem necessitatibus.,2016-07-02T12:29:32.819Z
18,Exercitationem deserunt voluptates corporis blanditiis quibusdam omnis ipsum. Temporibus occaecati architecto voluptatem a quis eligendi. Nihil et repudiandae sit rerum minus magnam reprehenderit laboriosam. Reprehenderit iste dolorum quisquam aut doloribus. Deserunt velit odit modi excepturi. Molestias veritatis asperiores impedit voluptas culpa quis sit consectetur. Iusto perferendis fugiat quos magni minima. Consequatur accusantium nobis a. Natus quas sit ea voluptas porro.,2012-10-11T08:10:26.619Z
19,Voluptate maiores autem sit. Qui voluptates repellat dolore rerum reprehenderit occaecati provident repudiandae tenetur. Quia sunt perspiciatis ipsa aut ullam dolor porro consequatur. Amet atque doloribus magni quos. Unde qui explicabo alias et temporibus nihil possimus. Labore voluptas facere ducimus. Rem omnis dolorum nulla omnis quisquam exercitationem dolor aut dicta. Soluta est et et dolorem maiores libero sunt aspernatur. Iusto quia illo aperiam.,2015-06-24T17:36:31.159Z
20,Amet ducimus et nesciunt nihil. Dignissimos accusamus minima aliquid qui est dolores quia aut. Quia iste excepturi. Voluptates libero sit. Fugit porro molestias voluptatibus qui. Quia accusantium sit blanditiis. Alias rem dolore magni aliquam sed hic nobis quasi. Sint culpa ut quia similique dolorem quos. Itaque autem animi iusto excepturi temporibus odio. Dolores quis et.,2014-02-03T05:32:55.265Z
21,Laborum voluptas corporis quo possimus dolor quisquam provident. Sint architecto tempora debitis laboriosam quis fugiat expedita in. Similique et voluptate consequatur maxime illum sapiente. Impedit velit et illum sequi eius. Sunt error debitis. Minima consequuntur pariatur culpa omnis vero optio. Quasi rerum maxime dolorem rerum ipsa. Error porro eveniet.,2014-06-13T10:53:37.864Z
22,Veritatis qui dolores voluptatem ipsum quos voluptas velit vitae. Ullam dolorum ut dolores. Explicabo enim est recusandae assumenda beatae voluptates. Iure qui ut minus sit. Eum necessitatibus alias et voluptates aut qui suscipit voluptatem pariatur. Consequatur ut consectetur quaerat maxime reprehenderit velit beatae qui quia. Incidunt saepe qui iure unde rerum sit. Rerum ipsa quisquam asperiores laboriosam ex quas. Consequuntur iusto sint id error nisi qui. Est harum ipsum at reprehenderit porro. Blanditiis corrupti nesciunt veniam adipisci nesciunt ut corrupti officiis et.,2017-05-25T01:09:17.317Z
23,Itaque mollitia maxime velit velit sit. Repudiandae et enim fugiat magni nulla explicabo voluptas soluta. Nostrum ut quidem quae nobis repellendus qui necessitatibus quia. Veniam laborum doloremque sequi qui sunt qui corrupti. Pariatur fuga minima cumque modi eveniet maxime voluptatem maxime. Molestiae eaque et ad cupiditate voluptatibus omnis. Vero fuga architecto voluptatum. Repudiandae sit voluptatum exercitationem et sapiente delectus numquam est. Labore et nisi ipsam atque aut libero.,2017-11-15T16:30:03.789Z
24,Saepe illum modi laborum optio debitis inventore totam eius. Perferendis voluptate illo nisi excepturi facere. Quia et ipsam rem sit tempora ratione ut magnam. Et at qui. Consequatur omnis exercitationem ad reiciendis. Ullam voluptas voluptatibus voluptatem sit. Sunt corrupti fugit ex sit aperiam.,2014-10-27T23:17:35.373Z
25,Ad et natus. Velit omnis quae eos reiciendis dolore. Quam omnis autem eligendi vel quo. Voluptatum et neque. Ut minima asperiores eius aut. Non vitae ipsam sunt est. Quia nihil corporis consectetur corrupti pariatur ipsam facere. Soluta facere sint est nisi et quia quidem maiores deserunt. Voluptas ea quis. Ut rerum quo rem ea odio et. Omnis sed vel quod.,2017-10-06T18:14:00.700Z
26,Quae assumenda dolor repudiandae. Animi quia qui quam nobis quod ea id laudantium aut. Maiores commodi necessitatibus voluptatem optio doloremque eveniet velit. Ullam rem quas dolor. Et omnis eligendi cum. Et neque eum possimus quae ipsa tempore minus itaque dolor. Veritatis vel sunt. Voluptatem fugiat expedita veniam explicabo quibusdam vitae. Ut earum eius quis at laborum. Animi explicabo corrupti ducimus. Voluptatem veniam quae repudiandae ea consequuntur.,2020-01-19T10:02:49.302Z
27,Et non sit dolorem voluptatem. Sapiente et exercitationem hic est laudantium eum. Facilis temporibus quisquam ut et labore ipsum pariatur pariatur. Ut enim quia a assumenda sit et. Repellat magnam provident illo quis nihil dolor omnis pariatur. Dolores et consectetur qui quis rem repudiandae dolorem rerum. Non minus velit veritatis et. Rerum harum veritatis.,2017-08-04T22:17:52.982Z
28,Sapiente eos reiciendis incidunt. Quia eaque qui quis qui recusandae. Ipsa dolorem voluptas. Ratione rem officia. Aut sunt qui blanditiis delectus rerum et officia quaerat et. Nulla nulla perspiciatis vero corrupti explicabo eligendi. Accusantium quas quae voluptas laudantium. Magni et recusandae dignissimos mollitia. Eum eum assumenda non. Omnis vero aliquid. Et magni eligendi minima beatae doloribus eum.,2010-12-06T06:31:30.300Z
29,Consequatur consequuntur ut. Reprehenderit delectus recusandae sed saepe aut. Tempora autem nemo sint sint amet eum. Et non ut iste ad provident. Aut odit sint quis accusamus excepturi. Nesciunt quia accusantium ab fuga dicta ut porro sint sit. Dolorum dolores maxime voluptatibus voluptatum tempora culpa libero. Aut voluptas nihil ipsa odio aspernatur eius ab veniam. Sit omnis sed aut molestias ipsum esse voluptatibus.,2014-05-20T19:50:57.540Z
30,Et odit totam aut ut cum aut illum. Et alias eum vel laudantium modi. Quasi quaerat et dolorum ducimus dignissimos qui et sed iste. Minus est et laborum mollitia alias voluptatem necessitatibus est aliquid. Quidem quia praesentium vel consectetur. Nesciunt rerum dolor fuga asperiores dolores. Quos voluptatibus laborum quae. Officiis esse ipsam.,2011-05-15T09:31:27.835Z
31,Accusamus facere et dignissimos id et qui provident enim. Veritatis rerum a qui. Atque voluptates id cum maiores a est illum suscipit adipisci. Soluta placeat quis et est. A similique blanditiis et quod veritatis in cumque natus. Tempora quam et. Omnis voluptatem similique rerum. Aut nobis iste. Facere ut debitis laborum nam error at laboriosam enim.,2017-03-14T01:37:37.326Z
32,Consequatur id aut possimus et. Beatae itaque quasi nesciunt ut alias veniam accusamus. In at nihil eius. Vel aperiam assumenda quo consequatur qui ea eos et. Autem excepturi qui et et fuga. Ullam nam nemo qui cumque recusandae enim quisquam eum quis. Accusantium sunt voluptas. Fugiat illum dolores nulla nulla. Quae aliquid pariatur inventore aliquid expedita mollitia. Beatae odio fuga reiciendis.,2019-06-14T08:51:47.175Z
33,Harum voluptatibus quo ratione occaecati assumenda inventore esse dolorum. Ut quidem quia deserunt. Voluptas in vero doloremque explicabo voluptatum. Aperiam consequuntur officia voluptas eveniet quisquam. Aut possimus officia enim sunt repellat recusandae non porro non. Est ut repellat repellat qui. Ex laboriosam dolor dicta nihil qui debitis. Sunt asperiores exercitationem. Itaque quia voluptatum. Aperiam quisquam nemo non accusantium quas nihil incidunt iure rerum.,2012-10-10T01:45:28.458Z
34,Et modi omnis omnis adipisci tempora molestiae. Quia enim facere. Cum placeat non facere rerum ea animi autem sapiente provident. Rerum magni sequi magni dolores voluptatem reiciendis. Mollitia inventore odit voluptatem maxime nesciunt consequatur. Dolor nesciunt error exercitationem. Recusandae repellendus voluptas aliquid natus. Ut dignissimos aut quo voluptatem quod eum odio porro. Facilis culpa consectetur enim quidem iste delectus qui rerum.,2018-11-21T02:08:42.676Z
35,Doloremque labore est ullam quas eaque cum aut. Quibusdam et sit labore in assumenda et eius. Aliquam enim quis recusandae amet et id in. Fuga dolorem sunt sint aut quas odio qui. Ab exercitationem voluptatibus. Ipsam id debitis et alias.,2013-10-03T11:28:17.223Z
36,Dicta qui dolorem enim itaque dignissimos. Et voluptatem consectetur. Quidem ex minus ut voluptatum labore porro ullam laboriosam quia. Beatae adipisci voluptas placeat dolores id voluptatibus aut. Et in saepe. Odit itaque iusto qui at voluptatum in qui. Beatae assumenda expedita repellendus itaque in exercitationem perferendis. Recusandae fugit voluptas voluptatum aliquid sed quo quaerat non. Fugit veritatis ipsam at aut alias tenetur.,2019-08-02T05:31:15.398Z
37,Facilis debitis nam alias sed voluptas laboriosam optio voluptatem. Accusamus omnis quis laboriosam dolor praesentium eius. Ducimus magnam tempora. Quisquam asperiores est voluptas omnis. Blanditiis quo ab in veniam fugiat. Occaecati voluptatem sint sit consequuntur. Rerum possimus quas esse ipsum. Nihil ut aut ad. Tempore nihil sit velit. Est est similique. Enim qui fuga ratione quo.,2020-04-18T10:45:17.920Z
38,Fugiat et vitae dolorem modi aut officia occaecati et. Repellendus eaque est hic ad ratione et voluptates praesentium. Maxime in reiciendis voluptates alias adipisci in. Fugiat modi quia alias eos est repudiandae neque quibusdam repudiandae. Vero ut corrupti dignissimos ipsa. Sit molestiae deserunt.,2019-04-27T09:52:49.706Z
39,Repellendus repellendus at magni incidunt corrupti amet nisi. Natus et repellendus ipsa aut. Sed soluta reprehenderit sed sit facere cum temporibus. Ullam ut nihil in aut eos recusandae perferendis dolores. Est aut omnis aut magnam sunt quibusdam rerum et. Adipisci est voluptatibus ea consectetur non ex quis. Est cum totam. Dolor dicta deleniti quisquam at perferendis illo qui. Incidunt eum laboriosam ea distinctio.,2019-02-01T14:32:27.804Z
40,Ut vitae consequuntur porro. Dolorem neque consequuntur ut quo illo vel. Veritatis temporibus est nesciunt nemo ut dicta dolorem adipisci voluptatem. Id deleniti provident accusantium dolor. Ipsa cum ut sint assumenda. Quia rerum dolorum sapiente ipsam culpa nemo consequatur perspiciatis tempore. Voluptatem officiis quia alias in dolores nobis sit. Commodi minus quas dignissimos minima. Cum molestias quae doloremque voluptas eum eos nostrum.,2011-02-10T05:59:31.989Z
41,Molestias possimus voluptatibus placeat. Quos mollitia nulla et. Nihil tempora harum quasi et. Nam soluta maxime accusamus sit et qui nam. Facilis reprehenderit qui harum facilis facilis pariatur quia expedita. Dolor et corrupti neque eos vel molestiae. Possimus aliquam aperiam quod voluptas voluptatem. Suscipit ratione sed nemo alias.,2016-05-31T14:55:44.255Z
42,Voluptas corrupti maxime assumenda et. Consequatur atque voluptas praesentium assumenda quas cupiditate nesciunt corporis facilis. Quo ut occaecati quis qui similique harum repellendus quo quod. Aperiam est voluptas asperiores atque ut adipisci qui dolorum. Cupiditate tempora tempore aut provident. Voluptate officiis a officiis. Culpa eos quisquam. Sunt quia voluptas a ullam. Aperiam laboriosam eos nemo commodi. Vel unde et quasi asperiores voluptas.,2010-09-20T15:18:07.229Z
43,Quos id ab aut voluptas. Enim totam omnis nostrum repellendus repudiandae possimus ea. Et numquam quibusdam natus eos aspernatur. Labore eum delectus dolorum qui et. Accusantium qui cum doloribus iste. Dolore modi quisquam numquam reiciendis consequatur consequatur. Voluptas quisquam quae eveniet sint. Ipsam aliquid tenetur dolore voluptatem explicabo illum omnis totam.,2019-05-31T00:08:21.408Z
44,Mollitia autem id libero dignissimos est qui. Consequuntur minima numquam sunt quia ea aut dicta voluptas cumque. Dolore minus ab iusto voluptatem ducimus explicabo dolorum totam. Minus quo fugiat omnis eligendi voluptates harum ducimus natus adipisci. Excepturi corrupti aliquid omnis molestiae enim sit sit quidem. Molestias et tempora id excepturi. Id iste aliquid. Dolores et aperiam. Amet aliquam eveniet temporibus molestias. Rerum sit ut. Tempora magni aut architecto molestiae est numquam.,2015-04-05T03:26:02.827Z
45,Aperiam sed hic assumenda officia excepturi. Nostrum id iure qui aspernatur quam dolores. Nisi cum iste sequi consectetur. Reprehenderit facilis error quaerat impedit architecto dolores minus ut. Mollitia excepturi quibusdam odit voluptas ratione quo. Veniam eligendi voluptatibus. Perspiciatis voluptatibus recusandae. Quibusdam sed iusto ullam at ipsum nihil perspiciatis nisi in. Dolor sint dolore et. Dolor aut ab ab dolorem qui quae quis nihil. Est ea facere corporis nobis. Qui consequatur recusandae voluptates laudantium fugit voluptatem iusto quod.,2017-12-23T13:35:25.712Z
46,Rerum est inventore et aut et consequatur necessitatibus. Et voluptate et dolore assumenda. Enim assumenda ex. Ut harum alias illo architecto quis adipisci. Et consequatur nobis in. Corporis rerum culpa consequuntur. Tempora fugiat ad quis ut animi adipisci.,2018-08-19T13:23:45.427Z
47,Qui officia iste. Qui et et. Quis quia ipsa ipsa. Delectus in enim perspiciatis ipsum deserunt iste. Blanditiis voluptatem aspernatur est et. Rerum qui quis. Quis error ducimus rerum ab aut quam.,2020-06-23T19:56:31.773Z
48,Dolorem qui maxime dolorem beatae voluptates qui et distinctio quia. Sint rem accusantium modi repudiandae illo consequatur necessitatibus sunt qui. Voluptatem doloremque dolor quia et magnam molestias. Corrupti qui et. Porro ipsum voluptates totam. Exercitationem reprehenderit earum molestias earum. Praesentium reprehenderit labore sed et minima est quaerat. Vitae eveniet minus dolor non repellendus aliquid sapiente neque incidunt. Neque enim fuga illum ab cupiditate nihil quod. In ut et tenetur.,2013-12-30T11:42:35.345Z
49,Laborum quo quae. Voluptatem ea sit et. Autem provident dolorem quisquam porro. Facere ullam non. Mollitia quis necessitatibus aperiam magni magnam rerum. Saepe totam omnis explicabo non dignissimos voluptatem veritatis eveniet. Dolorum incidunt beatae molestiae consequatur. Sequi ut labore molestiae ex molestias quisquam architecto earum architecto. Voluptatem et earum quod corporis ipsum ipsa blanditiis minus.,2014-05-22T14:54:56.133Z
50,Modi nesciunt iste ad. Ut enim adipisci sed aut adipisci. Excepturi amet voluptatem dolorem perferendis a quibusdam iusto culpa itaque. Architecto saepe molestiae voluptatem libero placeat. Sed suscipit sed. Perferendis non ex inventore. Velit eum facilis sed non cupiditate. Quia inventore expedita sunt quidem et. Perspiciatis officia veniam enim.,2016-05-02T14:07:48.708Z
51,Omnis voluptates iure ea quam sit. Placeat et rerum et sit dolore sit ea laboriosam. Sed alias enim. Amet illum asperiores est nemo vel asperiores vel alias. Provident placeat aut non sed quia neque. Mollitia non neque aut sed. Est quidem consequatur. Quia ex est eveniet aut dolore et labore veniam. Aut officia optio sit accusamus voluptatem perspiciatis.,2011-01-06T04:42:58.801Z
52,Perspiciatis non est et. Enim voluptatem laboriosam nobis eius nihil. Eos quo facere repellendus fugit aut tenetur necessitatibus minima corporis. Rem corrupti voluptas commodi suscipit doloremque minus facilis velit. Rerum eos libero rem at pariatur et sint. Cupiditate laborum reiciendis dolor aliquam assumenda facere pariatur. Facere possimus sit et quo asperiores. Et a qui vel velit. Qui perspiciatis est autem. Sapiente rem sit eveniet eaque voluptatem aut cum. Nostrum error distinctio asperiores ea dolor cum omnis.,2013-10-14T04:41:55.186Z
53,Repellendus qui saepe neque. Unde architecto quaerat voluptas repudiandae cumque temporibus autem. Placeat odio recusandae minus minus rerum asperiores delectus molestias aspernatur. Voluptatum sed in esse doloremque omnis. Animi sit asperiores rerum aut aliquam ut nobis nemo. Quis non dolores culpa eum accusantium voluptate. Suscipit dolor non dolore consequatur necessitatibus. Velit dicta amet dolores maxime.,2018-12-30T15:51:17.866Z
54,Et aut dolorum nulla reiciendis saepe atque libero quo possimus. Dolor dolore nulla unde eius repellat facere voluptatibus nobis. Sint nesciunt repudiandae eligendi ipsum blanditiis et. Quod doloremque vitae aut eos blanditiis et esse sint. Deserunt beatae ut qui et quaerat sed ab inventore. Dolores ut ratione saepe quibusdam quas. Iure itaque distinctio et rem ut deleniti molestiae. Pariatur ea repellendus ut.,2019-10-25T23:37:08.424Z
55,Quia numquam et doloribus sed dolor corrupti sit. Repudiandae tempora ex ab quas vel tempora. Harum quas dolore eos et. Neque et corrupti. Error nostrum ad ut laborum. Beatae voluptates aliquam pariatur in pariatur dolor quis. Facilis qui inventore aliquid voluptatem ullam. Ratione optio itaque rerum officiis expedita. Amet molestiae sint porro impedit et sit. Accusantium dolores a voluptate at molestias aut sequi aperiam sed.,2016-11-27T08:51:24.946Z
56,Modi eaque qui ut. Eum odit cupiditate. Consequuntur similique ut distinctio totam facere laboriosam molestias quos consequatur. Eveniet totam laborum non corrupti qui rerum omnis id et. Et ut aut ut. Ad ipsum nam quaerat ea omnis. Voluptatibus et beatae explicabo vitae qui quaerat. Aut sed in omnis tempore. Blanditiis et repudiandae. Rem illo architecto saepe dolorum asperiores ipsam omnis nam sed. Aperiam placeat quo esse cupiditate eum repellat id dicta est.,2014-03-15T09:46:45.902Z
57,Nobis aliquid non ducimus eum sed maiores quasi. Culpa beatae voluptatibus nisi vel. Impedit veniam ut ab commodi. Odio non molestias consequuntur sit deleniti quo ipsum id libero. Facere sapiente fugiat corrupti ullam. Omnis qui et deserunt quis totam culpa. Non harum et dolores vitae esse. Aut assumenda omnis quo repellendus possimus. Voluptas et dolorem aut nobis. Omnis magnam illum.,2016-06-28T07:29:01.232Z
58,Aut et sunt cum porro facilis. Quo aut et dolores hic rem corporis quia rem. Non vel veritatis omnis. Autem omnis deserunt voluptas voluptate dolor dignissimos enim. Dolorum nisi consequatur ut. Perspiciatis rem odit incidunt itaque. Et reiciendis deserunt quis. Vel fugit quae. Vel ut officia cumque voluptas.,2018-10-25T23:31:10.560Z
59,Et fuga amet est qui consectetur. Vitae blanditiis autem sit cupiditate et ipsam soluta quaerat ex. Hic ut aut quo quas voluptates necessitatibus voluptas sed provident. Sit aut suscipit. Asperiores autem accusantium laudantium illum excepturi cumque. Modi minus unde vel doloremque deleniti explicabo. Cum libero voluptatem culpa sit eligendi eum nemo. Ea id repudiandae veniam est similique quae. Ut possimus architecto recusandae quae.,2020-02-12T19:43:22.642Z
60,Accusantium laboriosam voluptates necessitatibus dolores rerum. Mollitia quos inventore adipisci minima. Aut reprehenderit aut. Laudantium accusamus voluptatem. Accusamus et ratione cum reiciendis quia tempora. Qui labore qui pariatur quaerat. Optio maxime rerum neque earum iusto. Dicta ducimus similique qui eligendi deserunt eos cupiditate. Atque qui voluptatibus. Veniam aspernatur aspernatur ea dolorem.,2019-09-17T02:30:05.534Z
